id,title,type,short_description,opening_hours,city,address,zip_code,min_price,max_price,latitude,longitude,rating,url,imgurl,distance_ray
284,Hummbar,"","With its prime location in a former bank off Rembrandtplein, the neon-lit heart of the city?s nightlife scene, and a crowd-pleasing menu of lobster and burgers, Hummbar seems on to a winning formula. ","",AMSTERDAM,Utrechtsestraat 111,1017 VH,6,26,52.364551,4.898088,5,http://www.hummbar.com,"",0.315591391848906
29,Hotel Het Hert Van Weesp,Dutch,Hotel.,Mo -Sa : 10:00 - 21:30 hour Su: 10:00 - 20:30 hour,AMSTERDAM,Van Baerlestraat 52,1071 BA,9,29,52.357931,4.878446,5,http://www.smalltalkamsterdam.nl,https://media.iamsterdam.com/ndtrc/Images/20110131/4e3f604d-0f99-43bd-b076-86bc3afce070.jpg,1.23980068744439
210,New King,Chinese,"One of the best, most hospitable Chinese restaurants in town. Ideally suited for business lunches as well as for a romantic dinner for two.","",AMSTERDAM,Zeedijk 115-117,1012 AV,8,28,52.373036,4.90117,4,"",https://media.iamsterdam.com/ndtrc/Images/20121116/fd044d21-3215-4abf-bab0-40c64af0fb6d.jpg,1.82930812052
211,Foodware,International,"Foodware is a food store with an international selection of dishes, including a host of vegetarian options. Despite being more of a shop than a restaurant, you?re more than welcome to eat your meal on site. Choose your meal from the available dishes, freshly prepared every day.","",AMSTERDAM,Westerstraat 116,1015 MN,7,27,52.378553,4.883412,4,"",https://media.iamsterdam.com/ndtrc/Images/20121116/d6c7465d-b267-40ac-81f0-8aff3eac2f49.jpg,1.76974216124507
212,Los Pilones,Mexican,"Los Pilones serves a variety of authentic Mexican dishes in traditional cantina-style surroundings. Stop here for homemade guacamole and tortilla chips, tacos, enchiladas and more. Wash down your dinner with a refreshing margarita or one of the many imported tequilas from their well-stocked bar. ","",AMSTERDAM,1e Anjeliersdwarsstraat 6,1015 NR,9,29,52.378122,4.883372,4,"",https://media.iamsterdam.com/ndtrc/Images/20121116/647f2ae7-36b2-49ba-8c06-99667c09569f.jpg,0.216139592117413
389,Auberge Jean & Marie,French,"Fine French dining in the Albert Cuypstraat, from lunch to dinner and late night drinks.","",AMSTERDAM,Albert Cuypstraat 58-60,1072 CV,8,28,52.354638,4.889289,5,http://www.aubergeamsterdam.nl,https://media.iamsterdam.com/ndtrc/Images/64/64df5972-722d-4466-ac9f-a1658f1ac32d/2437939b-e64f-4170-8f23-761c03c5731f.jpg,2.9988759497475
281,Restaurant Red,"","Located on Amsterdam?s Keizersgracht, Restaurant Red serves quality food in a friendly, casual atmosphere.","",AMSTERDAM,Keizersgracht 594,1017 EN,6,26,52.36407,4.889166,4,http://www.restaurantred.nl/index.html,https://media.iamsterdam.com/ndtrc/Images/c8/c8cbfe0a-a2a3-4ca6-879e-b007cca66dc7/ef9c7b05-8219-4746-bf3d-836508cd754b.jpg,2.81995221632139
282,Lazagne,Italian,The Dutch saying `klein maar fijn' (small but beautiful) is definitely applicable to Lazagne: you can enjoy delicious lasagnes at this small Italian takeaway in Amsterdam West. ,Tu -Su: 17:00 - 21:30 hour.,AMSTERDAM,Frederik Hendrikplnts 21h,1052 XP,5,25,52.37823,4.875407,3,http://lazagne.com/,https://media.iamsterdam.com/ndtrc/Images/3e/3eeee5fa-ee55-4f1a-922c-77b5687d8b41/ad4458c1-cc29-4f1b-ac56-a42181fb663f.jpg,1.88177690282731
125,La Rive,French,"The clientele at the swanky InterContinental Amstel Hotel Amsterdam may be rock stars and royalty, but anyone can book at the Michelin-rated La Rive restaurant. Experience a crafted menu of French-Mediterranean cuisine with a restrained sprinkling of Middle Eastern and Asian flavours.",Mo -Su: 18:30 - 22:00 hour.,AMSTERDAM,Professor Tulpplein 1,1018 GX,7,27,52.360038,4.905497,3,http://www.restaurantlarive.nl/,https://media.iamsterdam.com/ndtrc/Images/20120522/7c5d7f8e-df60-448c-ba97-cd90177b7e55.jpg,2.94663981908016
126,La Vallade,French,"A French pearl is hidden on the Ringdijk in the Watergraafsmeer: restaurant La Vallade. It has a country-style interior with French antiques and it has a big terrace full of flowers and plants. One eats what is on the daily menu: a five-course dinner for a reasonable price. These are pure Mediterranean dishes without fuss. Think of a soup of grilled peppers, baked hake with anchovies and lemon.","",AMSTERDAM,Ringdijk 23,1097 AB,6,26,52.354305,4.926925,3,"",https://media.iamsterdam.com/ndtrc/Images/20120522/c53454b8-2bb1-4706-9536-a230be790803.jpg,0.707997664996396
117,Herengracht,"","Herengracht is a modern chic place with a good terrace facing the water. Inside it is comfortable and lavish with soft couches and plenty of places to sit. On the menu are classics such as vitello tonnato, carpaccio and sashimi. For many business people in the city centre, this is the perfect place for networking. On the walls is the work of artist Peter Donkersloot. There is a permanent exhibition of his figurative paintings: from a giant portrait of Marilyn Monroe to a comical piglet.","",AMSTERDAM,Herengracht 435,1017 BR,7,27,52.367064,4.888283,4,http://www.deherengracht.nl,"",1.1616307790099
120,Carino's Italian,Italian,Typical italian restaurant with homemade product.,"",AMSTERDAM,Westerstraat 144,1015 MP,8,28,52.378388,4.8825,4,http://www.ristorantepepe.nl,https://media.iamsterdam.com/ndtrc/Images/20120522/80f2e7c8-48f1-434c-8604-052b7c4442f6.jpg,0.779777388949112
145,Frank Pepe Pizzeria Napoletana,Italian,Typical italian restaurant with homemade product.,"",AMSTERDAM,Herengracht 534,1017 CG,9,29,52.364585,4.896178,5,"",https://media.iamsterdam.com/ndtrc/Images/20120522/8085e6a3-1438-4158-ae34-64dcf6b68dcf.jpg,0.62745747060442
17,Cioccolateria,Italian,Awesome chocolate shop.,Mo -Su: 11:00 - 23:00 hour.,AMSTERDAM,Weesperzijde 135,1091 ES,5,25,52.349641,4.912877,3,http://www.girassol.nl,https://media.iamsterdam.com/ndtrc/Images/20110127/2cd4894e-5ece-4d65-80a5-a09607c2314a.jpg,0.766524310816222
95,Caravaggio,Italian,Typical italian restaurant with homemade product.,"",AMSTERDAM,Leidsegracht 84,1016 CR,9,29,52.365974,4.881636,3,http://www.cafegeorge.nl,"",0.792653647605604
183,Revan,"","",Mo -Su: 13:00 - 23:00 hour.,AMSTERDAM,Van Woustraat 206-212,1073 NA,7,27,52.350714,4.903324,4,"","",0.363486497344505
79,Assagi,Italian,"Assagi means 'taste' in Italian and that is indeed the case in this restaurant of the same. Located in the heart of the Jordaan, the decor is simple but the atmosphere warm. The menu is classic Italian. There are the traditional antipasti such as squid and mozzarella caprese, homemade pappardelle and ravioli and lamb cutlets in a crust.","",AMSTERDAM,Tweede Egelantiersdwarsstraat 6,1015 SC,9,29,52.37682,4.881959,3,"",https://media.iamsterdam.com/ndtrc/Images/20120521/9e089194-1f09-4f59-8ca5-7ac7fd76b86f.jpg,1.48459166665643
243,Sla,"","","",AMSTERDAM,Ceintuurbaan 149,1072 GB,9,29,52.3544,4.899216,3,http://www.ilovesla.com,https://media.iamsterdam.com/ndtrc/Images/20131125/c964a3ee-0f05-49aa-97dc-97f1f4644aab.jpg,3.89102713887858
159,The White Elephant,"","The White Elephant in the Van Woustraat is one of the best Thai restaurants in the city. Super fresh food is served up on genuine Thai crockery. And although the decor is authentic and rather standard they do love experimenting here. As well as classic dishes, on the menu are unusual things like banana flower salad and even crocodile in red curry!","",AMSTERDAM,Van Woustraat 3,1074 AA,9,29,52.357544,4.899706,5,http://www.whiteelephant.nl/,https://media.iamsterdam.com/ndtrc/Images/94/941da467-ad7e-4175-a1ed-1dc80e345bfb/0f22dfb5-84a1-4892-aa65-e995050bf0a5.jpg,2.95269030630102
103,Drago restaurants,Italian,Typical italian restaurant with homemade product.,"",AMSTERDAM,Reguliersdwarsstraat 80-82,1017 BN,5,25,52.365936,4.893797,3,http://www.dantica.nl,"",0.738132230509985
106,Caffé Opera,Italian,Typical italian restaurant with homemade product.,"",AMSTERDAM,Rietlandpark 373,1019 EM,6,26,52.374133,4.935501,5,http://decantine.nl/,https://media.iamsterdam.com/ndtrc/Images/20120521/6d09ef07-e7cf-4934-b874-e1cee506c812.jpg,0.573100088329278
107,Caffé Vittoria,Italian,Typical italian restaurant with homemade product.,"",AMSTERDAM,Leliegracht 26-28,1015 DG,6,26,52.375264,4.886738,5,http://www.restaurantdeluwte.nl/,https://media.iamsterdam.com/ndtrc/Images/20120521/1e629a39-bf6e-46b0-a674-541734d5e815.jpg,1.68149788109828
144,Prego,"","Prego is in a tall building in the Herenstraat with a mezzanine and walls that have been stripped right back. Wooden tables, silver cutlery and linen napkins - everything radiates quality. This goes for the wine and the food as well. On the menu are dishes such as oysters gratin, stewed shin of lamb and skate in a herby beurre blanc.","",AMSTERDAM,Herenstraat 25,1015 BZ,7,27,52.377229,4.888638,3,http://www.pregorestaurant.nl/,https://media.iamsterdam.com/ndtrc/Images/20120522/399e8b9c-8c09-44f5-8b87-3ba255e40416.jpg,9.07344746280431
157,The Colour Kitchen,International,The Colour Kitchen combines the world?s most delicious cuisines with incomparable hospitality. Choose from a variety of meals with international influences or let the chef surprise you with the specials of the day. ,"",AMSTERDAM,Jan Evertsenstraat 747,1061 XZ,5,25,52.369585,4.835686,3,http://www.thecolourkitchen.com,https://media.iamsterdam.com/ndtrc/Images/20120523/a182f43f-1585-4092-9c0a-c796f183086c.jpg,0.753330574375445
158,The French Cafe,French,"If you fancy some thoroughly French cuisine go to the The French Caf_ in the Pijp. In this atmospheric restaurant with white table cloths, beautiful crockery, nice wall-paper and an open kitchen one can have typically French dishes such as steak tartar, oysters and fish soup: there are also fresh creations with Asiatic influences. All to be found in the heart of the Pijp  ","",AMSTERDAM,Gerard Doustraat 98,1072 VX,8,28,52.355639,4.892424,3,http://www.thefrenchcafe.nl/,https://media.iamsterdam.com/ndtrc/Images/20120523/5e8c91a8-9968-4456-ae88-6c1a1942ef95.jpg,0.862775399414153
267,De Silveren Spiegel,Dutch,De Silveren Spiegel ? the Silver Mirror ? offers traditional Dutch food in the stunning surroundings of a 17th-century building. ,"",AMSTERDAM,Kattengat 4-6,1012 SZ,5,25,52.378033,4.894575,3,http://www.desilverenspiegel.com,"",0.295561121158521
111,Frankie & Benny's,Italian,Typical italian restaurant with homemade product.,"",AMSTERDAM,Prinsengracht 381,1016 HL,9,29,52.371664,4.883153,5,http://www.envy.nl,https://media.iamsterdam.com/ndtrc/Images/20120521/9dd6099c-28e0-4c8c-a3ec-46520ff36f5c.jpg,2.19009239839066
217,Hap-Hmm,Dutch,Hap-Hmm serves up tradition in more than one way: its traditional Dutch food is complimented by the fact that the time-honoured Amsterdam eatery has been running for a staggering 60 years. ,"",AMSTERDAM,Eerste Helmersstraat 33,1054 CZ,9,29,52.36371,4.876282,4,http://www.hap-hmm.nl/,https://media.iamsterdam.com/ndtrc/Images/f5/f598123c-d211-46aa-bcb3-2cc502bfe50e/d76a2aa1-25e1-434a-9217-120cbfcd1ad4.jpg,1.13391724670005
132,Ferrara Bakery and Cafe,Italian,Typical italian restaurant with homemade product.,"",AMSTERDAM,Tweede Leliedwarsstraat 13,1015 TB,8,28,52.375462,4.880777,4,http://www.restaurantmantoe.nl/,https://media.iamsterdam.com/ndtrc/Images/20120522/8dfcafdb-284c-4904-8194-d86ed3c2893f.jpg,2.34832265971415
177,I Gemelli,"","","",ASSENDELFT,Dorpsstraat 393,1566 BE,9,29,52.466676,4.740704,3,http://www.i-gemelli.nl/,https://media.iamsterdam.com/ndtrc/Images/20120814/9aab49b5-b7a1-41a1-b1a1-6362a8342c7d.jpg,11.5649231534715
250,Vondelpark3,"","","",AMSTERDAM,Vondelpark 3,1071 AA,9,29,52.361035,4.874989,5,http://www.vondelpark3.nl,https://media.iamsterdam.com/ndtrc/Images/20140324/5d76613f-b455-49f6-9cd0-14942d3dda70.jpg,0.766731060442801
303,The Harbour Club Kitchen,"","","",AMSTERDAM,Apollolaan 2,1077 BA,9,29,52.347989,4.884547,3,http://theharbourclub.com/kitchen,https://media.iamsterdam.com/ndtrc/Images/86/863bcfe7-4962-4550-8d3c-205c46da2f8c/a2956baf-2005-410b-8141-f457a5426714.jpg,2.08034911936146
369,Guadalupe,Mexican,Discover the culinary delights of the exotic Mexicans cuisine in front of the Amsterdam?s central station. The traditional ?Mexicans- tapas? offer you the opportunity to sample many different dishes at the same time.,Mo -Su: 09:00 - 00:00 hour,AMSTERDAM,Prins Hendrikkade 92,1012 AE,7,27,52.376628,4.902082,3,http://www.facebook.com/Guadalupe-Amsterdam-310911389108792/,"",0.369320136297909
402,Wilde Zwijnen,International,Child-friendly restaurant offering superb international cuisine.,"",AMSTERDAM,Javaplein 23HS,1095 CJ,6,26,52.363591,4.940394,3,http://www.wildezwijnen.com,https://media.iamsterdam.com/ndtrc/Images/0b/0b08ede7-2505-475e-af80-ef408a64d885/005994c8-ac3e-451f-bd77-4da2bc9dd1df.jpg,1.19944646386888
113,Caravaggio,Italian,Typical italian restaurant with homemade product.,"",AMSTERDAM,Oude Waal 11,1011 BZ,5,25,52.373153,4.903484,5,http://www.hemelsemodder.nl,https://media.iamsterdam.com/ndtrc/Images/20120522/8d102b3c-c1d0-4f35-9fdf-15808b5b0db2.jpg,1.90800523228513
44,Het Onde Dy,Dutch,Dutch restaurant.,"",BADHOEVEDORP,Sloterweg 299,1171 VB,9,29,52.331488,4.769721,3,"","",0.918692056275566
127,Restaurant Non è la Rai,Italian,Italian restaurant.,"",AMSTERDAM,Amsteldijk 41,1074 HV,8,28,52.35511,4.905498,4,"",https://media.iamsterdam.com/ndtrc/Images/20120522/2899796b-3227-402b-85c2-607b07c16c6a.jpg,0.684292774456113
306,DWDD pop-up restaurant,"","","",AMSTERDAM,Pazzanistraat 8,1014 DB,7,27,52.386343,4.872816,5,http://www.vara.nl/dwddpopup,https://media.iamsterdam.com/ndtrc/Images/7d/7d4aa3bf-3904-4f59-a205-0fa2057f920e/0a1ae895-2299-4a49-8e12-d84e834d2cee.jpg,17.4914614160273
123,Drago restaurants,Italian,Typical italian restaurant with homemade product.,"",AMSTERDAM,Lindenstraat 17,1015 KV,9,29,52.379675,4.885353,5,"",https://media.iamsterdam.com/ndtrc/Images/50/50284e1f-9314-4e1d-9cd7-0e50109c19a1/51a03191-1eb7-436d-a379-543b171a346d.jpg,2.03522954559491
43,Remore Perdute,Italian,Italian restaurant with long background,"",HOOFDDORP,Boslaan 7,2132 RJ,8,28,52.30075,4.702781,5,http://www.lhirondelle.nl,"",1.48800733896858
48,Pancho's Cantina,Mexican,"Pancho's cantina is a Mexican restaurant in the centre of Zaandam. In the summer, guests can eat in the pavement restaurant.  ","",ZAANDAM,Rozengracht 20-21,1506 SC,9,29,52.438753,4.821699,5,http://www.panchoscantina.nl,https://media.iamsterdam.com/ndtrc/Images/20110217/d1a087ca-e7c5-4ee0-baaf-2f30d9e86319.jpg,42.3489688377509
245,Julius Bar&Grill,"","","",AMSTERDAM,Ceintuurbaan 256-260,1072 GH,7,27,52.35254,4.890174,4,http://www.juliusbargrill.nl,https://media.iamsterdam.com/ndtrc/Images/20131205/48c28879-6c31-4ef1-9f89-98b1a83c87d9.jpg,2.46614797422798
279,Morlang,"","Open for lunch and dinner seven days a week, this restaurant and bar offers a delightful menu of daily and seasonally changing dishes.","",AMSTERDAM,Keizersgracht 451,1017 DK,5,25,52.366339,4.886223,5,http://www.morlang.nl,https://media.iamsterdam.com/ndtrc/Images/fb/fbd9f7e8-7ad7-4abd-8e07-9078cab3e6ac/b678e157-b659-4e56-9b15-7f96bf684bd1.jpg,1.24308987136745
301,Bistro Zuidlande,"","","",AMSTERDAM,Nova Zemblastraat 586,1013 RP,8,28,52.390943,4.878566,5,http://www.bistro-zuidlande.nl/,https://media.iamsterdam.com/ndtrc/Images/49/490ac5c0-0b97-426e-934e-833237181225/7d580288-903c-4b49-a55f-571db5855681.jpg,2.16196512347127
302,Ron Gastrobar Oriental,"","","",AMSTERDAM,Kerkstraat 23,1017 GA,9,29,52.365864,4.884799,5,http://www.rongastrobaroriental.nl,https://media.iamsterdam.com/ndtrc/Images/8d/8d1d9eed-932a-41cd-9d2e-926a14dc5d9c/609caa42-e29d-4e75-a176-d5237a37bba3.jpg,2.04339988258501
49,Mizuno Sushi,Japanese,Sushi restaurant,"",HOOFDDORP,Arnolduspark 10,2132 CR,8,28,52.309466,4.705433,3,http://www.senbazuru.nl,"",16.2551861817029
299,Vijfnulvijf,"","","",AMSTERDAM,Insulindeweg 505,1094 MK,5,25,52.361341,4.935594,3,http://vijfnulvijf.nl,https://media.iamsterdam.com/ndtrc/Images/01/018c70fd-f947-4fd1-bab5-4df56244bbc6/47e080cd-8279-499a-a25d-c257ac795a5c.jpg,1.99873496456475
312,Roomservice at Olof's,"","Roomservice at Olof?s is a glamorous pop-up restaurant situated in Amsterdam?s oldest chapel, the St Olofskapel. ","",AMSTERDAM,Zeedijk 2a,1012 AX,6,26,52.373203,4.900119,5,http://www.roomserviceatolofs.com,https://media.iamsterdam.com/ndtrc/Images/a4/a48bcd44-5693-49b2-b665-70db32eb5072/382801a7-169f-4cf5-95a7-895be016a024.jpg,1.18655500881443
83,Blok 4,"","Dining on dishes of bouillabaisse, osso buco and gurnard with tapenade you can find a wonderful place in the sun at Blok 4 on IJburg.","",AMSTERDAM,IJburglaan 500,1087 BT,9,29,52.358434,4.98871,5,http://www.blok4.nl/,"",1.1887326066721
399,Skek,Dutch,Skek is a restaurant and bar that fuses traditional Dutch food with all the newest eating trends. It is located near Amsterdam's Red Light District.,"",AMSTERDAM,Zeedijk 4-8,1012 AX,7,27,52.375998,4.900295,4,http://www.skek.nl/,https://media.iamsterdam.com/ndtrc/Images/99/99690865-8ef6-4014-b2b6-a49d8c01f777/264a9366-a816-4ebc-a162-6a990dfecd18.jpg,1.78567872950106
265,Pata Negra,Spanish,"Pata Negra is a small chain of authentic Spanish restaurants in Amsterdam. Since the original location opened in 1997, its chefs have been dedicated to preparing dishes using traditional culinary techniques and only the freshest of ingredients from Spain. ","",AMSTERDAM,Utrechtsestraat 124,1017 VT,7,27,52.361723,4.899003,3,"",https://media.iamsterdam.com/ndtrc/Images/c2/c2cc797e-d710-4334-b7e0-1e747af3e297/06e8d069-752b-446e-9d00-6ebd033faa17.jpg,1.00578543474784
129,Lof,"",Lof in the Haarlemmerstraat exudes a certain nonchalance: the decor is simple with wooden tables and chairs and gingham tea cloths for napkins. The staff are plain-speaking and display a certain tongue-in-cheek arrogance. All the more surprising then are the culinary delights served up: each day at Lof the staff serve a new menu- one chooses from three dishes and can enjoy the unusual creations made from the best of ingredients.,"",AMSTERDAM,Haarlemmerstraat 62,1013 ES,8,28,52.380322,4.892325,5,http://www.lofrestaurant.nl,https://media.iamsterdam.com/ndtrc/Images/20120522/bce46a4f-a66a-43d0-b76a-fcdfdd253fb3.jpg,0.756169793852625
135,Mayur,Indian,For Indian cuisine in modern surroundings go to restaurant Mayur and the adjacent lounge bar Mayur Delight. The Sharma family have been serving Northern Indian specialities here following traditional recipes for years. There is meat that has been marinated for 24 hours before being cooked in the tandoor (wood stove). The only trace of Western influence is the extensive wine and champagne list and the decor of velvet and wood.,"",AMSTERDAM,Korte Leidsedwarsstraat 203,1017 RB,7,27,52.362346,4.886096,4,"","",1.72717864929599
285,BAUT Zuid,"","Following its success at two previous locations, Amsterdam restaurant BAUT is on the move again: this time popping up at a new location in Amsterdam Zuidas.","",AMSTERDAM,Prinses Irenestraat 31-33,1077 WV,8,28,52.341607,4.876079,3,http://www.bautamsterdam.nl,https://media.iamsterdam.com/ndtrc/Images/13/13e47ab4-4b10-4056-9229-18f2f788f33e/22302760-2efe-48c7-8172-bf9c17620f29.jpg,0.484697035173467
286,The Fat Dog,"","Situated in Amsterdam zuid, this funky diner dedicated to all things hotdog takes the simple sausagey snack to a whole new level with a range of imaginative toppings and trimmimgs. ",Mo -Su: 12:00 hour.,AMSTERDAM,Ruysdaelkade 251,1072 AX,7,27,52.349844,4.886787,4,http://www.thefatdog.nl,https://media.iamsterdam.com/ndtrc/Images/22/227629c3-b14b-40ed-9951-89d68ab356e8/323c8669-228a-4ef9-a28e-8c42f30ec804.jpg,0.365217826066794
309,Lion Noir,"",Oysters and cheese plates and everything in between are served in stylish surroundings at Lion Noir on Amsterdam's Reguliersdwarsstraat. ,"",AMSTERDAM,Reguliersdwarsstraat 28,1017 BM,6,26,52.366385,4.890446,5,http://www.lionnoir.nl/,https://media.iamsterdam.com/ndtrc/Images/a1/a1498523-3b4d-4265-a345-ff06ea3d8560/87022eca-7738-4804-9479-5e815f5e063e.jpg,2.20922705490657
89,Campisi's Egyptian Restaurant,Italian,Typical italian restaurant with homemade product.,"",AMSTERDAM,IJburglaan 1289,1087 GJ,7,27,52.354499,4.997174,4,http://www.bloemopijburg.nl,https://media.iamsterdam.com/ndtrc/Images/20120521/5ac081a9-3646-427e-b7ba-9da414dc8f7b.jpg,2.09487463288161
169,Winkel 43,"",The Winkel homemade apple cake is renowned across Amsterdam. Winkel is also an ideal spot to enjoy a convivial meal and drink in the evening too. One can enjoy the views over the Westerstraat and Noordermarkt from the terrace. On Friday nights the apple cake bakers work overtime to cater to the organic Saturday market visitors queuing at the door.,"Mo : 07:00 - 01:00 hour, Tu -Th : 08:00 - 01:00 hour, Fr : 08:00 - 03:00 hour, Sa : 07:00 - 03:00 hour, Su: 10:00 - 01:00 hour.",AMSTERDAM,Noordermarkt 43,1015 NA,5,25,52.379518,4.88654,5,"","",1.67427021991672
148,Raänaraä,"","Chef-owner Laurent Med Khellout offers a taste of his native Algeria?s enchanting nomadic cuisine in a stunning location at Amsterdam's Westergasfabriek, with high beamed ceilings, bright windows, copper lamps and walls the colour of Sahara sand. Expect various warm and cold mezze (think hummus, merquez sausages and veal kfta), flame-grilled fish and halal meats, harissa-spiked tajines with couscous and flaky baklava.","",AMSTERDAM,Polonceaukade 40,1014 DA,6,26,52.385937,4.87144,4,"",https://media.iamsterdam.com/ndtrc/Images/20120522/bdb47a86-081d-495e-b1b1-31e648b185e8.jpg,0.944220956289767
248,Restaurant Stedelijk,"","Part of the renowned Stedelijk Museum Amsterdam, Restaurant Stedelijk is an eatery for all ages, for business or pleasure, museum visitors or passing tourists. What?s more it has a dish to suit every budget.",Mo -Su: 08:30 - 00:00 hour.,AMSTERDAM,Museumplein 10,1071 DJ,5,25,52.356429,4.879801,3,http://www.restaurantstedelijk.nl,https://media.iamsterdam.com/ndtrc/Images/20140123/0505b715-9ced-494a-bfb2-4e6934a46437.jpg,0.954760470505964
252,Omelegg,"","Omelegg pride themselves on being the Netherlands? first ?omeletterie?. And they?re not joking around when it comes to egg cravings, providing their first customers? fix from 7 in the morning. ","",AMSTERDAM,Ferdinand Bolstraat 143,1072 LH,6,26,52.34881,4.893638,3,http://www.omelegg.com,https://media.iamsterdam.com/ndtrc/Images/20140923/445fe79e-c7d6-4126-ab9b-4a7dd1e470b4.jpg,2.48374316283989
287,Restaurant As,"","","",AMSTERDAM,Prinses Irenestraat 19,1077 WT,8,28,52.341788,4.880009,4,http://www.restaurantas.nl,https://media.iamsterdam.com/ndtrc/Images/2a/2a1ba8aa-9f5d-4278-a3da-03553422aaf1/53000d0a-d0e3-499b-a4b2-0bd78837ef02.jpg,1.74886371034293
439,Eetsalon van Dobben de Pijp,Dutch,"This typical Amsterdam deluxe lunchroom is the meeting place of artists, soccer players and many other locals. Its Van Dobben croquette is famed far beyond the city limits. A great place to eat traditional Dutch food. You can get them freshly served by typical Amsterdam waiters, it doesn't get more Amsterdam than this.  Great pea soup with ham, corquettes and other such delicacies. Well priced and cheery atmosphere. This is their second shop and close to the famous Albert Cuyp Market.","",AMSTERDAM,Ferdinand Bolstraat 53,1072 LB,5,25,52.355583,4.890597,3,"",https://media.iamsterdam.com/ndtrc/Images/20110721/64af6c31-ee80-4bcf-8fc0-5142599e3d17.jpg,3.38401948713709
47,De Brasserie,Brasserie,"","",NIEUW-VENNEP,Venneperweg 471,2153 AD,5,25,52.264404,4.634798,4,http://www.brasserienieuwvennep.nl,"",15.7738835134363
437,George No 5 ? Mer du Nord,French,Amsterdam?s fanciest ?New York-style French bistro? goes sur la plage with this new outing in Zandvoort.,"",ZANDVOORT,Boulevard Barnaart 65,2041 JA,5,25,52.3817,4.531105,3,http://www.cafegeorge.nl/george-zandvoort/,https://media.iamsterdam.com/ndtrc/Images/91/91491866-f080-4b30-905d-0d359a286a55/4d03b309-4b4e-4726-a743-20d3f16399eb.jpg,4.1980489198098
162,Van Harte,"", Van Harte restaurant has a relaxed and contemporary look and feel where you can enjoy creative dishes.   ,"Mo : 10:00 - 18:00 hour, Tu -Th : 10:00 - 23:00 hour, Fr , Sa : 10:00 - 00:00 hour, Su: 10:00 - 18:00 hour.",AMSTERDAM,Hartenstraat 24,1016 CC,5,25,52.37237,4.885558,5,"",https://media.iamsterdam.com/ndtrc/Images/20120523/9e4b469c-8a7f-4dd8-b1ae-8f673de023d7.jpg,0.435653024749824
81,Bar Waldorf,Italian,"Bar Waldorf in the Jordaan district is a major port of call for creative Amsterdam residents. The interior of the long narrow room is deliciously snug with its wallpaper, standard lamps and Persian rugs covering the tables, but nevertheless the feel is modern. An enormous photograph of a snow-clad Neu Schwanstein- the castle belonging to the mad Bavarian King Ludwig- dominates the room. The Italian food is surprisingly good and inexpensive to boot.","",AMSTERDAM,Elandsgracht 2,1016 TV,7,27,52.370288,4.882295,4,"","",1.143272644822
236,Uit de Keuken,"","The fresh food in this Amsterdam traiteur-cum-caf_ comes with integrity as owners serve sustainable, organic, and local products when possible. Linger over breakfast or sandwiches in the caf_ while contemplating what to take home. Don?t forget extra treats like homemade organic ketchup and slow-pressed juices. ","Mo -Fr : 08:30 - 20:00 hour Sa , Su: 10:00 - 20:00 hour",AMSTERDAM,Bellamystraat 2,1052 BL,5,25,52.367539,4.867585,3,"",https://media.iamsterdam.com/ndtrc/Images/20130808/e1fb2871-ce7a-425c-8363-497583612ce5.jpg,1.12836626485717
237,Het wapen van Middelie,"","","",MIDDELIE,Brink 1,1472 GB,5,25,52.530978,5.013861,3,http://www.hetwapenvanmiddelie.nl,https://media.iamsterdam.com/ndtrc/Images/20130912/71825725-076b-4e6a-ad7b-fb8268fa1fce.jpg,26.4242029003183
293,Pinxobar,"","Located right by the water at IJburg, this restaurant serves the eponymous pintxos ? traditional Basque, tapas-like snacks? plus food from a barbecue and an array of gin and tonics. ","",AMSTERDAM,IJburglaan 500,1087 BT,5,25,52.358434,4.98871,5,http://www.pinxo.nl,https://media.iamsterdam.com/ndtrc/Images/58/58576f07-5195-4908-956b-dccc6e87db68/66fe45d0-94ac-4cc5-ac38-85cc30cb2b57.jpg,7.17452521195079
