id,title,type,short_description,opening_hours,city,address,zip_code,min_price,max_price,latitude,longitude,rating,url,imgurl,distance_ray
5,Caf_ het Paleis,Cafe,"Caf_-restaurant Paleis, just behind the Paleis (Palace) on the Dam, has been a favourite for years because of its affordable dishes and is also a great spot to drop in for a drink. Many students come to this cosy but modern place after their exams, shoppers come here after a day out and freelancers hold their work meetings here. It has a nice terrace in the summer. Tarts, filled rolls, pasta, salads and soups are on the menu.","Mo : 09:30 - 00:00 hour Tu -Th : 09:30 - 01:00 hour Fr , Sa : 09:30 - 02:00 hour Su: 09:30 - 00:00 hour",AMSTERDAM,Paleisstraat 16,1012 RB,7,27,52.372302,4.889015,5,"",https://media.iamsterdam.com/ndtrc/Images/20110124/7baf3cbe-8c82-43e7-9813-30dd2ef2bcd2.jpg,0.484441236651113
19,Il Sardino,Italian,Italian restaurant with awesome fresh fish dishes.,Mo -Su: 07:00 - 00:00 hour.,AMSTERDAM,Oude Haagseweg 20,1066 BW,7,27,52.337214,4.817336,5,http://www.accorhotels.com,https://media.iamsterdam.com/ndtrc/Images/20110128/a0312475-5d9b-4722-8636-36987c1b3ff4.jpg,0.62507602555862
20,Palazzo,Italian,"In 2013, Palazzo once again opens its doors in Amsterdam starting from the middle of November. For 10 years, Palazzo has offered the ultimate combination of world-class entertainment and exquisite cuisine in an old-fashioned ?mirror palace? ? a very ornate type of circus tent.","",AMSTERDAM ZUIDOOST,Arena boulevard 61-75,1101 DL,9,29,52.313094,4.941695,3,http://www.palazzo.nl,https://media.iamsterdam.com/ndtrc/Images/20110128/4b340cee-da9c-48ec-b28b-001c124be5ed.jpg,0.788171945035797
21,Panagia,Greek,"Treat yourself to authentic Greek delights in this restaurant right in the centre of Amsterdam, near the Central Station. Fresh vegetables and special ingredients are used every day to prepare the meals.",Always open,AMSTERDAM,Nieuwendijk 31,1012 MA,5,25,52.378254,4.895494,3,"",https://media.iamsterdam.com/ndtrc/Images/20110128/b2144cbd-a0e4-447f-b45c-1cc3df85ab7d.jpg,7.7614283765773
22,La Sedia,Italian,Tasty Italian restaurant based on North traditions.,Mo -Su: 10:00 - 18:00 hour.,AMSTERDAM,Kerkstraat 148,1017 GR,8,28,52.363379,4.888824,3,"",https://media.iamsterdam.com/ndtrc/Images/20110128/5bb15ec5-a497-493c-b0e3-0cc5fc3b3698.jpg,0.648783326027291
24,The Heart of Sushi,Japanese,All you can eat sushi restaurant.,Mo -Su: 10:00 - 17:30 hour.,AMSTERDAM,Amstel 51,1018 EJ,5,25,52.365312,4.902542,3,http://www.neva.nl,https://media.iamsterdam.com/ndtrc/Images/20110128/da39c545-4f7b-49d1-a48c-46f1110d794b.jpg,2.25675550254783
37,Grill Steak House Maya,American,Grill Steak House Maya is located in the heart of Amsterdam next to the famous Leidseplein. Maya offers you the best grill specialties from Argentina. Enjoy the typical South American atmosphere and taste real Argentinean meat and spare ribs. There are also special offers for groups to 60 persons and package deals for companies.,"",AMSTERDAM,Korte Leidsedwarsstraat 111,1017 PX,5,25,52.363509,4.884426,5,http://www.grillsteakhousemaya.nl,"",9.68304933937881
38,La mi nonna in carriola.,Italian,"Italian restaurant with main dishes, pizzas and tasty meats",Always open.,ALMERE,Veluwezoom 45,1327 AK,7,27,52.359235,5.253718,4,http://www.hotelalmere.nl,https://media.iamsterdam.com/ndtrc/Images/20110216/65754987-9686-4dbd-a59c-9294920691dc.jpg,14.8507231343791
55,Restaurant Grand Cafe Applaus,Cafe,"Part of Lelystad?s Agora Theater, this restaurant and grand caf_ is a modern yet intimate place to enjoy a delicious meal devised by head chef Martijn van Wegen.",Mo : Open Tu -Sa : 11:00 hour Su: Open.,LELYSTAD,Agorabaan 14,8224 JS,9,29,52.512721,5.477151,5,http://www.restaurantapplaus.nl,https://media.iamsterdam.com/ndtrc/Images/20110217/0983c411-f09d-489a-af22-12612bec16d3.jpg,19.4389272740356
56,La tana del castoro,Italian,Italian restaurant,"",VELSERBROEK,Westlaan 41,1991 AL,9,29,52.423963,4.672834,3,http://www.villa-westend.nl,https://media.iamsterdam.com/ndtrc/Images/20110217/dd7ab6a5-2f94-4a01-a082-898bc394cb83.jpg,15.3280201060637
57,Cantina la vendemmia,Italian,Italian restaurant and wine taste,"",MIDDENBEEMSTER,Rijperweg 83,1462 MD,5,25,52.548566,4.911197,5,http://www.hetheerenhuis.nl,https://media.iamsterdam.com/ndtrc/Images/20110217/deae4f93-53b6-43b6-94e5-9223b6e68356.jpg,12.3540613713494
58,Tandoor,Indian,Indian restaurant.,"",LELYSTAD,Oostvaardersdijk 57,8244 PB,9,29,52.501319,5.414356,3,"http://www.dijkhuysje.nl/,http://www.facebook.com/dijkhuysje",https://media.iamsterdam.com/ndtrc/Images/20110217/f73ef489-ecd9-410e-900d-424e467ab3e3.jpg,15.1085887776935
77,Koni Store,Japanese,All you can eat sushi bar.,"",AMSTERDAM,Reguliersdwarsstraat,1017 BM,9,29,52.366189,4.892187,3,"",https://media.iamsterdam.com/ndtrc/Images/20120521/033af708-d81e-4aac-bbde-d1073a616dd1.jpg,1.4854119431817
91,Bond,French,"At Bond restaurant in Zuid (South) there is good dining and good surroundings. The owners have been inspired by the 60s resulting in a golden, simple space with a warm atmosphere. The food is modern French cuisine and the choice is changed monthly. Good old classics are entrec_te b_arnaise and steak tartar. It?s fine to just have a drink at the bar too-  a dry martini shaken, not stirred?","",AMSTERDAM,Valeriusstraat 128b,1075 GD,7,27,52.353801,4.867117,5,http://www.restaurantbond.nl,https://media.iamsterdam.com/ndtrc/Images/20120521/3384419e-0e18-44ae-88ee-ff42a9ef37ae.jpg,2.5164999797856
90,Masa,Japanese,All you can eat sushi bar.,"",AMSTERDAM,Binnen Dommersstraat 13,1013 HK,5,25,52.382978,4.885665,4,http://www.restaurantbloesem.nl,https://media.iamsterdam.com/ndtrc/Images/20120521/c9e6c3eb-f604-48e5-9c0b-81fb95146756.jpg,1.81160408744304
99,Cibo Espresso,Italian,Typical italian restaurant with homemade product.,"",AMSTERDAM,Heemstedestraat 80,1058 NP,8,28,52.351956,4.844418,4,http://www.cedars.nl,"",4.14424276637749
100,Da Marino,Italian,Typical italian restaurant with homemade product.,"",AMSTERDAM,Jan Willem Brouwersstraat 7,1071 LH,9,29,52.356252,4.878137,3,http://www.chang-i.nl,"",0.510148218657644
101,Caffé Opera,Italian,Typical italian restaurant with homemade product.,"",AMSTERDAM,1e van der Helststraat 62A,1072 NX,8,28,52.35522,4.893098,3,"","",2.92396749432672
110,Cibo Espresso,Italian,Typical italian restaurant with homemade product.,"",AMSTERDAM,Reguliersdwarsstraat 30,1017 BM,7,27,52.366189,4.892187,4,http://www.restaurantdynasty.nl/,https://media.iamsterdam.com/ndtrc/Images/20120521/8e0a5931-6545-453a-b5bb-e90ae48870f4.jpg,2.06406122613245
114,Da Marino,Italian,Typical italian restaurant with homemade product.,"",AMSTERDAM,Beethovenstraat 55,1077 HN,7,27,52.347894,4.877137,3,http://www.gauchosgrill.nl,https://media.iamsterdam.com/ndtrc/Images/20120521/41a0dfb6-37fc-4f99-a4a3-6dadb3642bca.jpg,1.74701999644009
118,Matsugen,Japanese,All you can eat sushi bar.,"",AMSTERDAM,Tweede Egelantiersdwarsstraat 9,1015 SB,6,26,52.376679,4.882178,3,"","",1.05486383131533
133,Drago restaurants,Italian,Typical italian restaurant with homemade product.,"",AMSTERDAM,Barentszstraat 243,1013 NM,8,28,52.388768,4.887091,4,"",https://media.iamsterdam.com/ndtrc/Images/20120522/eef64258-6c5a-4f1d-8f40-43b449821075.jpg,9.98689214414033
134,Maggiano's Little Italy,Italian,Typical italian restaurant with homemade product.,"",AMSTERDAM,Prinsengracht 703,1017 JV,7,27,52.365388,4.884494,5,http://www.mashua.nl/,https://media.iamsterdam.com/ndtrc/Images/20120522/bfc00c02-b9b2-4896-9a72-7c18146e6cde.jpg,1.15371620995765
136,East Side Mario's,Italian,Typical italian restaurant with homemade product.,"",AMSTERDAM,Utrechtsestraat 28,1017 VN,5,25,52.364421,4.897942,5,http://meghna.nl/,https://media.iamsterdam.com/ndtrc/Images/20120522/8b5ce8e1-2a35-44de-9d6d-e4dee761edd7.jpg,1.27151595747076
146,Kapitein Zeppos,French,"In a picturesque alley not far from the Nes is Kapitein Zeppos. This cheerful caf_ is in a nineteenth century warehouse and has a bit of a Mediterranean atmosphere because of the colourful walls, the conservatory full of greenery and the terrace. They play French chansons but they also have regular live performances as well. The rather international menu has dishes prepared from seasonal ingredients. ","",AMSTERDAM,Gebed Zonder End 5,1012 HS,6,26,52.369563,4.893759,5,http://www.zeppos.nl/,https://media.iamsterdam.com/ndtrc/Images/20120522/1b0abb75-249a-4606-ad4e-a81f51bad8e8.jpg,0.941917685071624
140,MOS Burger,Japanese,All you can eat sushi bar.,"",AMSTERDAM,Rozengracht 133-I,1016 LV,5,25,52.372982,4.879741,4,http://www.restaurantnomads.nl,"",1.77208024601745
178,Nihonryori Ryugin,Japanese,All you can eat sushi bar.,"",ZAANDAM,Westzijde 216,1506 GG,8,28,52.447986,4.819493,4,http://www.tolhuysaandezaan.nl/,https://media.iamsterdam.com/ndtrc/Images/20120813/e1bea25a-3ca8-4b47-afb2-6fb57ebe2b17.jpg,9.10470840240726
153,Spanjer en van Twist,Indian," At the modern caf_-restaurant Spanjer en van Twist on the Leliegracht, the menu is changed with the seasons. The dishes can vary from and Indian ?Main Dish? with dahl and mango-raita to an organic steak with caramelised chicory. From Monday to Thursday one can join the De Tafel van Spanjer (Spanjer?s Table) for a two-course dinner for a moderate price. In the summer it is delightful to sit on the terrace which is right on the canal-side.   ","",AMSTERDAM,Leliegracht 60,1015 DJ,5,25,52.375907,4.8848,5,http://www.spanjerenvantwist.nl/,https://media.iamsterdam.com/ndtrc/Images/20120523/3351fb0b-f079-4095-b287-635cf7f1a550.jpg,2.5164999797856
164,Vapiano,Italian,"On the Oosterdokseiland, not far from the Muziekgebouw aan het IJ (Music Building on the IJ) is the famous chain restaurant Vapiano. In a casual design interior with los of natural stone and wood, a herb garden and a real olive tree, hundreds of people can enjoy pizza from a brick kiln or homemade pasta or salad. The cooks are fast and make everything in front of you. If you have special wishes then all you have to do is ask.","",AMSTERDAM,Oosterdokskade 145,1011 DL,7,27,52.375578,4.90865,5,http://www.vapiano.eu,https://media.iamsterdam.com/ndtrc/Images/20120523/4651818d-7b66-4eae-8abc-666507da9362.jpg,1.13323975361477
166,Okonomi-mura,Japanese,All you can eat sushi bar.,"Mo -Th : 10:30 - 01:00 hour, Fr , Sa : 10:30 - 03:00 hour, Su: 10:30 - 01:00 hour.",AMSTERDAM,Nieuwmarkt 25,1011 JS,9,29,52.371982,4.900546,5,"",https://media.iamsterdam.com/ndtrc/Images/20120523/16ec8487-67c5-499b-950b-aabc60a581c0.jpg,0.0777016395069945
191,Assaggi,Italian,"","",AMSTERDAM,Tweede Egelantiersdwstr 4-6,1015 SC,7,27,52.376578,4.882167,5,"","",1.28260031256538
187,Sakae Sushi,Japanese,All you can eat sushi bar.,"Mo , Tu : 10:30 - 20:00 hour We -Su: 10:30 - 23:00 hour",AMSTERDAM,Frederik Hendrikplnts 36,1052 XS,5,25,52.377329,4.874415,5,http://www.flinderscafe.nl/,https://media.iamsterdam.com/ndtrc/Images/20120910/548e88ee-f8a9-429a-b25c-ec47aad5c8a1.jpg,2.22972811591483
194,Samurai Sam's Teriyaki Grill,Japanese,All you can eat sushi bar.,"",AMSTERDAM,Daniel Stalpertstraat 103,1072 XD,8,28,52.356187,4.891692,4,"",https://media.iamsterdam.com/ndtrc/Images/10/10646746-a6f5-4cad-ae90-06393d4c02d4/787b6d52-ddd2-4603-8f98-8a8f0f199035.jpg,1.7744707210624
206,Tanuki,Japanese,"","",AMSTELVEEN,Pieter Lastmanweg 9,1181 XG,5,25,52.302646,4.862542,4,http://www.restaurant-tanuki.nl/,https://media.iamsterdam.com/ndtrc/Images/20120913/f7a7ae24-f212-4a14-9016-02046dd737fd.jpg,1.70179396368517
207,Het Jagershuis,French,"You?ll find this quality French-International restaurant to the south of Amsterdam in Ouderkerk aan de Amstel, in a beautiful waterside location  in a curve in the River Amstel. Focusing on unadulterated flavours, the restaurant?s _ la carte menu offers a range of seasonal gastronomical delights. The Jagershuis is also a hotel, featuring 9 elegant rooms and 2 suites overlooking the Amstel.","",AMSTELVEEN,Amstelzijde 4,1184 VA,8,28,52.295755,4.897227,4,"",https://media.iamsterdam.com/ndtrc/Images/20120913/25edf7a7-ab21-4163-9dc8-5ba97ab418ec.jpg,1.16034561613976
223,Nepalese Restaurant Mt. Everest,Indian,"Mt. Everest invites you to try the delightful and surprisingly exotic dishes of northern India and Nepal. While Indian food is well known, Nepalese favourites are somewhat less familiar. Typical dishes include fish, meat and curries ? but often with different ingredients than their Indian counterparts. ","",AMSTERDAM,Spreeuwenpark 3,1021 GS,5,25,52.383795,4.913007,5,http://www.mteverest.nl/,https://media.iamsterdam.com/ndtrc/Images/20130128/e64e8939-5e96-44a8-89c7-e108c3ca0a31.jpg,2.01081810978859
225,Restaurant De Chinese Muur,Chinese,"","",KUDELSTAART,Einsteinstraat 79A,1433 BD,9,29,52.235616,4.750739,5,http://www.chinesemuurkudelstaart.nl/,https://media.iamsterdam.com/ndtrc/Images/92/92b987be-278c-4bb2-b6d1-b7a7a4cbc1d7/6dfe8185-d953-4e08-81eb-11c3a351ecbd.jpg,20.1315638157684
239,Sarku Japan,Japanese,All you can eat sushi bar.,"",AMSTERDAM,Nieuwe Leliestraat 16A,1015 SP,5,25,52.376019,4.883877,5,http://www.carokookt.nl,https://media.iamsterdam.com/ndtrc/Images/20131113/171e76e0-18aa-42eb-b55e-7ebe3c07fb7a.jpg,1.26598660254691
240,Sasabune,Japanese,All you can eat sushi bar.,"",AMSTERDAM,Albert Cuypstraat 91,1072 CP,9,29,52.355251,4.8912,4,http://eten-bijmij.nl,https://media.iamsterdam.com/ndtrc/Images/20131113/bb770646-fcd5-4f94-96dc-7019ab3228fd.jpg,1.98209494877007
259,Restaurant Sinne,French,"In the heart of Amsterdam?s De Pijp neighbourhood, Sinne offers its own take on classic French cuisine and Mediterranean delicacies.","Mo , Tu : Closed We -Su: 17:00 - 21:45 hour.",AMSTERDAM,Ceintuurbaan 342,1072 GP,9,29,52.353031,4.894037,5,"http://www.restaurantsinne.nl,http://www.couverts.nl/reserveren/?tt=18978_12_225204_&r=http%3A%2F%2Fen.couverts.nl%2Frestaurant%2Famsterdam%2Frestaurant-sinne",https://media.iamsterdam.com/ndtrc/Images/20141229/51190e60-0335-4364-8373-cbc7448884e0.jpg,2.26512913859686
257,Standing Sushi Bar,Japanese,All you can eat sushi bar.,"",ENKHUIZEN,Compagnieshaven 3,1601 ZA,7,27,52.703036,5.297602,4,http://www.demastenbar.nl,https://media.iamsterdam.com/ndtrc/Images/20141127/2778f026-e7a2-4891-a843-d7d8f3446302.jpg,3.53479832015635
275,Bojo,Indonesian,The Indonesian restaurant Bojo was started in Amsterdam more than 40 years ago by two cousins who had sailed the world on the Holland America Line for many years. ,"",AMSTERDAM,Lange Leidsedwarsstraat,1017 NG,5,25,52.364301,4.884214,3,http://www.bojo.nl,"",1.50266890870191
273,Sticks'n'Sushi,Japanese,All you can eat sushi bar.,"",AMSTERDAM,Wibautstraat 95-97,1091 GK,8,28,52.3561,4.911596,5,http://www.stek-amsterdam.com/,https://media.iamsterdam.com/ndtrc/Images/20150326/59c3f21d-d7d5-4f2b-b4d7-7836598be3b2.jpg,1.72985904399025
291,Mother India,Indian,The chef of this Indian takeaway has been more than 20 years experience with cooking delicious Indian specialties. ,"",AMSTERDAM,Ter Haarstraat 14,1053 LJ,7,27,52.370312,4.869813,5,http://www.motherindia.nl,https://media.iamsterdam.com/ndtrc/Images/0b/0b03c31e-4f6d-43cb-857e-54b7a95398b8/bf36ed5b-a39b-43ed-a613-82c0ada4f5a7.jpg,7.27138996963336
296,Sukiyabashi Jiro,Japanese,All you can eat sushi bar.,"",AMSTERDAM,Spaarndammerstraat,1013 ST,5,25,52.388996,4.879727,4,http://dophertcatering.nl,https://media.iamsterdam.com/ndtrc/Images/3e/3e47b230-e0b0-4df5-b572-aff3aaae86ab/4d3ce719-e573-4785-949b-53be7231191d.jpg,1.90204085235462
315,Sushi of Gari,Japanese,All you can eat sushi bar.,Always open.,AMSTERDAM,Overhoeksplein 1,1031 KS,7,27,52.384419,4.902449,3,http://adamtoren.nl/,https://media.iamsterdam.com/ndtrc/Images/b5/b5d582b4-6c03-436e-900b-53db56a555d2/af0c7c31-1090-4762-88a8-52314a761494.jpg,1.52995254992768
328,Thrill Grill,Dutch,"If you are craving a juicy burger made with 100% Dutch beef, look no further than the Thrill Grill, a restaurant that is dedicated to the love and ultimate creation of the grilled delicacy held together on a poppy seed bun. Along with beef, there are also gourmet burgers made with salmon, pulled pork, chicken and falafel ? and hot dogs too. ","",AMSTERDAM,Gerard Doustraat 98,1072 VX,8,28,52.355842,4.892512,5,http://www.thrillgrill.nl/,https://media.iamsterdam.com/ndtrc/Images/56/56999748-10b2-4654-b044-d9b1e97ccac8/0584175b-a1b7-49cd-8c7b-27f3151a93b5.jpg,2.13189305696716
342,La Cantinetta Wine&Pasta,Italian,"","",AMSTERDAM,De Clercqstraat 105,1053 AH,7,27,52.370162,4.867153,4,http://www.cantinetta.nl,https://media.iamsterdam.com/ndtrc/Images/20131125/db1a7f54-14ba-4e54-8564-a2fc42883096.jpg,1.92513852237676
343,Razmataz,French,"A coffee house, French restaurant with a pinch of Italian thrown in, and a living-room-bar serving tasty gin & tonics and vermouth, all under one roof. Plus, a terrace. What more could you ask for?","Mo -Th : 08:30 - 01:00 hour, Fr : 08:30 - 03:00 hour, Sa : 10:00 - 03:00 hour, Su: 12:00 - 01:00 hour.",AMSTERDAM,Hugo de Grootplein 7-15,1052 KV,5,25,52.374522,4.873303,3,http://razmataz.nl,https://media.iamsterdam.com/ndtrc/Images/51/512738a7-24df-4476-876b-3e6ae826c20d/707110d3-fbeb-4711-84aa-7f700a302a8e.jpg,0.0559909523216351
356,Mazzo,Italian,"Mazzo brings a welcoming Italian living-room into Amsterdam?s bohemian Jordaan district. The simple, relaxed space ? an authentic Italian concept ? is one where everyone, young and old, can eat, drink, work, and socialise from early morning till late at night. ","Mo -Th : 09:00 - 01:00 hour, Fr , Sa : 09:00 - 02:00 hour, Su: 09:00 - 01:00 hour.",AMSTERDAM,Rozengracht 114,1016 NH,5,25,52.373214,4.879313,5,http://www.mazzoamsterdam.nl,https://media.iamsterdam.com/ndtrc/Images/4b/4b7c1f5c-ba44-425c-afe5-3ea8a67515af/b84c17bc-6406-4f0b-b39a-b56042cd06ee.jpg,0.520853652124428
357,Hoofdstad Brasserie,International,"The bright Hoofdstad Brasserie is open all day, with light, modern, international cuisine for breakfast, lunch and dinner. ",Mo -Su: 12:00 - 15:00 and 18:00 - 23:00 hour.,AMSTERDAM,Nieuwe Doelenstraat 2-14,1012 CP,8,28,52.367518,4.894305,4,http://www.hoofdstadbrasserie.nl,https://media.iamsterdam.com/ndtrc/Images/2e/2e7fc7d0-2850-4ec5-9d08-eb4f76dd8c0e/f7972410-ea3c-44a7-a4d2-2ad64cc83837.jpg,0.609561784484861
368,Pasta e Basta,Italian,"Pasta e Basta makes for a fantastic night out: with singing wait staff, traditional Italian pasta's and an exclusive wine list. Pasta e Basta is an adventure for all senses.",Mo -Su: 18:00 - 00:00 hour,AMSTERDAM,Nieuwe Spiegelstraat 8,1017 DE,7,27,52.364828,4.889848,4,"http://www.pastaebasta.nl,http://www.couverts.nl/reserveren/?tt=18978_12_225204_&r=http%3A%2F%2Fen.couverts.nl%2Frestaurant%2Famsterdam%2Fpasta-e-basta,http://www.facebook.com/PastaeBastaAmsterdam/",https://media.iamsterdam.com/ndtrc/Images/20110128/42fe5229-d7e9-4b38-acc9-4756ba1eccdc.jpg,3.01811981581752
381,Wagamama Max Euweplein,Japanese,"The Wagamama story began in 1992 they opened their first restaurant in London?s Bloomsbury neighbourhood. Inspired by traditional Japanese ramen bars (little stalls where they serve delicious noodles soups) and Asian flavours, Wagamama was designed to offer a new kind of dining experience ? one that offers fresh Japanese-inspired food in a friendly, vibrant setting. ","Mo -Sa : 12:00 - 23:00 hour, Su: 12:00 - 22:00 hour.",AMSTERDAM,Max Euweplein 10,1017 MB,7,27,52.362048,4.882832,5,"http://www.wagamama.nl,http://www.facebook.com/wagamama.nl/",https://media.iamsterdam.com/ndtrc/Images/20120523/f0c0f7fd-bc77-4779-9d97-f0df7ded274f.jpg,4.2278619147776
396,Conservatorium Brasserie,International,"The Conservatorium's Brasserie and Lounge are located in a beautiful internal glass courtyard which has spectacular floor-to-ceiling windows. The contemporary classic all-day dining options appeal to hotel guests, Amsterdam locals and international visitors. ","",AMSTERDAM,Van Baerlestraat 27,1071 AN,6,26,52.358624,4.878628,3,http://www.conservatoriumhotel.com/,https://media.iamsterdam.com/ndtrc/Images/94/94e3e688-c127-48b4-a9a9-1b6249d0e4f9/edb6dad6-556a-4e3d-a1cf-3133aac5d78d.jpg,1.34018501414108
397,Chiapas Taco Kartel,Mexican,"This popular eatery on Amsterdam?s Van Woustraat doesn?t claim authenticity, but rather a creative twist on Mexican favourites, inspired by the street food capital: Chiapas. ","",AMSTERDAM,Van Woustraat 29hs,1074 AB,6,26,52.356592,4.900053,4,http://www.taco-cartel.com,https://media.iamsterdam.com/ndtrc/Images/ac/ac5ca78f-9dca-4c36-9ce4-61203d81b0ff/5a26347f-da14-48fd-aae8-5db4248ff9f5.jpg,1.61959745327267
408,Caf_ Restaurant de Passage,Cafe,Caf_ and restaurant De Passage is an authentic Amsterdam restaurant located on Dam/Nieuwendijk. It specialises in Dutch and Mediterranean dishes.,Mo -Su: 11:00 - 20:00 hour,AMSTERDAM,Nieuwendijk 224,1012 MX,6,26,52.373656,4.892568,4,http://www.de-passage.com,https://media.iamsterdam.com/ndtrc/Images/20110125/b47aeedc-922a-4460-9851-dfce14341359.jpg,3.28198746735103
410,Eetcaf_ de Zeilhoek,Cafe,"","Fr 1 April 2016 including Fr 30 September 2016 Tu -Su: 12:00 - 22:00 hour, Sa 1 October 2016 including Fr 31 March 2017 We , Th : 16:00 - 22:00 hour, Fr -Su: 12:00 - 22:00 hour.",KATWOUDE,Hoogedijk 7,1145 PM,8,28,52.465892,5.040252,4,http://www.eetcafedezeilhoek.nl,https://media.iamsterdam.com/ndtrc/Images/20110217/3a1128bf-2318-4b7a-87bd-bc71b7c21af8.jpg,1.0669999742774
423,Grand Cafe Batavia,Cafe,"","",WORMER,Veerdijk 39,1531 MS,6,26,52.491826,4.798278,4,"",https://media.iamsterdam.com/ndtrc/Images/20120719/1974c0a7-3c3b-4bba-a9f0-1b17501faf2a.jpg,1.96494443926587
425,Eetcaf_ de Oude School,Cafe,"",Always open.,WARDER,Warder 128,1473 PH,9,29,52.564193,5.030332,4,http://www.cafedeoudeschool.nl,https://media.iamsterdam.com/ndtrc/Images/20131105/47fa5aa1-3856-4b47-bafe-ff2f60d587e4.jpg,0.616107036856327
427,Viscafe de Gouden Hoek,Cafe,"Located in the heart of the Westerpark neighbourhood, this charming seafood restaurant serves traditional fish and chips with gourmet twist.","Tu -Fr : 17:00 - 01:00 hour, Sa , Su: 16:00 - 01:00 hour.",AMSTERDAM,Van Limburg Stirumplein 10A,1051 BE,8,28,52.384566,4.874793,3,http://degoudenhoek.nl/,"",4.07771314883099
431,Caf_ Lennep,Cafe,Caf_ Lennep is a restaurant that serves a variety of classic dishes. It is based in Amsterdam West.,"",AMSTERDAM,Jacob van Lennepkade,1053 NJ,9,29,52.364163,4.867552,3,http://www.cafelennep.nl/,https://media.iamsterdam.com/ndtrc/Images/0a/0a897a87-65a8-48ef-8a4b-3b2c2cdfd9e7/481dccfc-457b-46ae-890a-ae37c003aa82.jpg,2.67256387216222
438,Safari Club,Cafe,"Surfing safari in Amsterdam beach: This friendly, colourful beach club with touches of hippy chic and industrial design organises various events.","",ZANDVOORT,Boulevard Paulus Loot,2042 AE,5,25,52.370198,4.523311,5,http://www.safariclub.nl/,https://media.iamsterdam.com/ndtrc/Images/45/45ac7f0c-b5fe-46e8-a665-12e70a1f2f44/c5a02bed-5e3d-45a8-9106-84cd97b3252b.jpg,1.17701075192032
455,De Drie Graefjes,American,"With two lunchrooms and two American Bakeries in the city centre of Amsterdam, De Drie Graefjes offers big, luscious slices of homemade cake and a rich lunch menu to match.  ","",AMSTERDAM,Gravenstraat 1,1012 NL,8,28,52.374233,4.893002,5,http://www.dedriegraefjes.nl/,https://media.iamsterdam.com/ndtrc/Images/91/913b0593-504a-4f01-a57c-bff4a7e361ce/821f6153-d678-4235-9293-abc0522026af.jpg,
456,Occo,Brasserie,"The Dylan?s all day bar brasserie takes pride in its quality and craftsmanship, offering a changing seasonal menu in a comfortable living room-style space.","",AMSTERDAM,Keizersgracht 384,1016 GB,9,29,52.36929,4.884014,5,https://www.dylanamsterdam.com/restaurants/brasserie-occo/,https://media.iamsterdam.com/ndtrc/Images/6f/6fe24583-d855-4138-9e56-df1cefa38039/d5d59b77-a7ad-4f6c-b8e5-a92de2370f31.jpg,
18,Il Tavolino di Omero,Italian,Tasty Italian restaurant based on Tuscany traditions.,"Mo -Th : 09:00 - 01:00 hour, Fr , Sa : 09:00 - 03:00 hour, Su: 09:00 - 01:00 hour.",AMSTERDAM,Dam 3-7,1012 JS,7,27,52.373127,4.89008,3,http://www.amsterdam-dam.com,https://media.iamsterdam.com/ndtrc/Images/20110128/3a139d4a-3a15-42e3-9564-737fe8327c6e.jpg,1.03251902128094
33,Hotel Apollo,Italian,Hotel.,Mo -Su: 12:00 - 23:30 hour.,AMSTERDAM,Rokin 18,1012 KR,9,29,52.371983,4.892898,4,"",https://media.iamsterdam.com/ndtrc/Images/20110201/54b14253-dce6-493e-ba85-df3ca4d58713.jpg,15.4990465882889
50,Esperando in Mexico,Mexican,Mexican restaurant with long background,"",AALSMEER,Dorpsstraat 15,1431 CA,5,25,52.270053,4.746467,4,http://www.hotelaalsmeer.nl,https://media.iamsterdam.com/ndtrc/Images/20110217/088192a1-9c46-4c6c-b3d7-d12c17b30412.jpg,19.7141296226927
23,All of Sushi,Japanese,All you can eat sushi restaurant with awesome fresh fish dishes.,"Mo -Th : 12:00 - 23:00 hour Fr , Sa : 12:00 - 04:00 hour Su: 12:00 - 23:00 hour",AMSTERDAM,Rembrandtplein 44,1017 CV,7,27,52.365775,4.897193,5,http://www.rain-amsterdam.com,https://media.iamsterdam.com/ndtrc/Images/20110128/e083c5e6-ffb5-488b-a618-bd06c6e73251.jpg,0.91165123897575
152,Sing Sing,American,"Bar/restaurant Sing Sing in Zuid (South) has been named after the famous American jail but is thankfully nothing like a miserable prison. Inside it is very relaxed and a bit retro. This spot attracts a lot of young business people who pop in for cocktails. On the lunch menu there are filled rolls, croquettes and salads and in the evening one can order pan-Asian dishes. The various small courses from China, Japan, Thailand, Vietnam and Indonesia are served in the 'shared dining' concept: one shares with others at table.","Mo -Th : 11:00 - 01:00 hour, Fr : 11:00 - 03:00 hour, Sa : 16:00 - 03:00 hour, Su: 16:00 - 01:00 hour.",AMSTERDAM,Cornelis Krusemanstraat 15,1075 NB,7,27,52.351179,4.86316,4,http://www.sing-sing.nl,https://media.iamsterdam.com/ndtrc/Images/20120523/28cbba80-0aa0-4194-a2c1-ab5e2742c01c.jpg,1.13013958785797
