id,title,type,short_description,opening_hours,city,address,zip_code,min_price,max_price,latitude,longitude,rating,url,imgurl,distance_ray
412,Caf_ De Pijp,Cafe,"Before you know it, you've spent the whole evening in caf_ De Pijp in the Ferdinand Bolstraat. Start with a drink on the terrace, pop inside for the Mediterranean dishes, then make your way to the bar for more drinks. The decor here is pretty retro and the DJs make for a lively atmosphere. The clientele is mostly students?drawn in by the affordable prices.","",AMSTERDAM,Ferdinand Bolstraat 17-19,1072 LA,9,29,52.356258,4.890704,3,http://www.goodfoodgroup.nl,https://media.iamsterdam.com/ndtrc/Images/20120521/a167e5d5-e190-4f0f-a84d-c675e548c4fd.jpg,0.517489938446434
414,Caffe Oslo,Cafe,"Caffe Oslo is in the west of the city- a bar/restaurant with a Scandinavian retro-interior with lots of huge lamps, brown tones and deer antlers on the wall. The retro-atmosphere is exploited to the full with music from the 80s playing: though the customers are not yet in their thirties. The restaurant serves up a variety of pastas but also serious main courses such as marinated venison steaks and potato truffle pancakes. Warning: Oslo is immensely popular so it?s best to book ahead of time.","",AMSTERDAM,Sloterkade 1A,1058 HD,9,29,52.357718,4.854327,4,http://www.caffeoslo.nl,https://media.iamsterdam.com/ndtrc/Images/20120521/7d327208-1e5c-45f6-8fe4-ad3d18d1a5dc.jpg,1.66525574555019
26,Rose's Cantina,Mexican,"Since the opening in 1980, Rose's Cantina has become one of the most vibrant Mexican restaurants in Amsterdam, offering a great combination of modern cocktails and authentic cuisine. ","Mo -Th : 17:30 hour, Fr , Sa : 17:30 - 03:00 hour, Su: 17:30 hour.",AMSTERDAM,Reguliersdwarsstraat 38,1017 BM,9,29,52.366189,4.892187,4,http://www.rosescantina.com,https://media.iamsterdam.com/ndtrc/Images/fd/fd2ed47c-627c-40da-95b1-dfdca832be62/36fad538-b5a6-44a5-a466-7f4ad1a6001c.jpg,2.65850201217028
319,Waterkant,"","With its huge, waterside terrace that enjoys full sunshine despite being partially tucked under a multi-storey building, colourful Surinamese caf_ bar Waterkant attracts an arty crowd of locals and in-the-know visitors.","Mo -Th : 11:00 - 01:00 hour, Fr , Sa : 11:00 - 03:00 hour, Su: 11:00 - 01:00 hour.",AMSTERDAM,Marnixstraat 246,1016 TL,6,26,52.370219,4.876949,4,http://www.waterkantamsterdam.nl/,https://media.iamsterdam.com/ndtrc/Images/90/909138ba-dbc2-4962-b007-26a79e398a02/7b1ea07b-c612-40bd-b3bb-7276ae509be1.jpg,0.581279779835388
383,Wagamama Centraal,Japanese,"Enjoying a prime spot at the rear of Amsterdam Central Station, Wagamama's newest Amsterdam hotspot offers diners top-notch Japanese-inspired cuisine with spectacular waterfront views. ","",AMSTERDAM,De Ruijterkade 36B,1012 AA,6,26,52.381261,4.896839,3,"http://www.wagamama.nl/,http://www.facebook.com/wagamama.nl/",https://media.iamsterdam.com/ndtrc/Images/8f/8f27531d-73fb-46f0-9382-4fb04c3469ea/80eeec3d-db3d-40f0-bd39-eefbc8fa2ac5.jpg,24.8172838760042
350,Dim Sum Now,Chinese,"Flavours like Chinese-cabbage-duck-garlic-ginger and spinach-carrot-chestnut-mushroom make for a refreshing change from usual suspects siu mai and ha kau at this new De Pijp dumpling specialist. With its hip cafeteria setting, fashionable young clientele and interesting selection of dim sum, gyoza and steamed buns, the complete offering here is very ?now? indeed - a fine choice for modern Asian cuisine in Amsterdam.","",AMSTERDAM,Ferdinand Bolstraat 36,1072 LK,8,28,52.356346,4.890402,4,http://www.dimsumnow.com/,https://media.iamsterdam.com/ndtrc/Images/0d/0d7b59ad-cafe-4fae-80f2-1a3489e5e6c1/32404dbc-ddef-46ea-8e8e-65329f51069b.jpg,0.572210501816302
386,Cafe Collette,French,Step out of Haarlem and into a French bistro in New York ? the surprising concept of Caf_ Collette that has charmed those in the know since 2011. ,"Mo -Th : 16:00 - 00:00 hour, Fr , Sa : 16:00 - 01:00 hour, Su: 16:00 - 00:00 hour.",HAARLEM,Oude Groenmarkt 22,2011 HL,6,26,52.380799,4.637624,4,http://cafecolette.nl/,https://media.iamsterdam.com/ndtrc/Images/5e/5e94ec49-14ac-4ad2-a6be-a7dea11b2098/2a207cf2-52e9-4f54-8ade-8c644ff4ed94.jpg,0.910547935551291
426,Caf_ Maxwell,Cafe,"?Caf_ Maxwell is situated on the corner of Oosterpark on the Beukenplein. To satisfy your breakfast, lunch and dinner cravings, the menu offers sandwiches, soups, salads, and shakes that accommodate vegetarian and organic preferences. ","Mo -Th : 11:00 - 01:00 hour, Fr , Sa : 11:00 - 02:00 hour, Su: 11:00 - 01:00 hour.",AMSTERDAM,Beukenplein 27,1092 BB,8,28,52.356802,4.91865,3,http://www.maxwellcafe.nl/index.html,https://media.iamsterdam.com/ndtrc/Images/b7/b7c4cb64-d636-4c35-b428-1d42c1549843/dc42a0bd-0fd6-400c-bf0e-13d99f61568c.jpg,1.39483424447098
51,Restaurant BoatHouse,American,"An excellent choice for lunch or dinner but also a terrific spot for parties, receptions or meetings. The Boathouse is well named, being right on the edge of the water and it's an impressive building that simply oozes the characteristics of water sport clubs of old that at one time graced American and British waterways. With lots of room and built to last, it is equally welcoming to both water sport enthousiasts and passers by. A perfect spot to relax, and chat about any and everything ",Mo -Su: 11:00 - 23:00 hour.,ALMERE,Noorderplassenweg 150,1316 VV,6,26,52.395538,5.212621,3,http://www.boathouse.nl,https://media.iamsterdam.com/ndtrc/Images/20110217/652db6cf-0291-4d13-b79e-9632c806401a.jpg,37.9351649575007
401,Bistro Bij Ons,Dutch,"This bistro has been named the cosiest eatery in the Jordaan neighbourhood, serving traditional Dutch lunch and dinner, including hearty, comforting stews, from 10.00 to 22.00. As a special features, diners are serenaded by Amsterdam singers performing traditional Dutch music. ","",AMSTERDAM,Prinsengracht 287,1016 GW,7,27,52.373798,4.883482,4,http://www.bistrobijons.nl,https://media.iamsterdam.com/ndtrc/Images/49/49084cd5-74b6-4d8f-ad08-faddd0e4bc4f/47dd9c52-c824-4217-bd3f-c190aaf2cbbd.jpg,1.2661355892428
405,Luitenant Cornelis,Dutch,"Located on historic Crossbow Street, a former 15th century shooting range, this restaurant was named for one of the subjects of Dutch master Frans Hals? famous militia portrait, The Meagre Company. ",Mo -Su: 12:00 - 01:00 hour.,AMSTERDAM,Voetboogstraat 15,1012 XK,9,29,52.368126,4.890755,3,http://www.restaurantcornelis.amsterdam,https://media.iamsterdam.com/ndtrc/Images/29/29b59918-5b86-4e29-82b3-a24850462e3d/9e815c4a-4a7b-4879-8c23-cf69dae5e050.jpg,1.7535870320993
359,Saravana Bhavan,Indian,"The long-established international chain specialising in South Indian vegetarian dishes has arrived in Amsterdam, with a big restaurant in de Pijp. ",Mo -Su: 12:00 - 22:00 hour.,AMSTERDAM,Stadhouderskade 123,1074 AV,6,26,52.357737,4.8995,4,http://www.saravanabhavan.com/index.php,https://media.iamsterdam.com/ndtrc/Images/23/2333b428-6866-40f5-8661-e04925628d6d/a9299609-7ef4-4819-9410-742cf7eb2b94.jpg,0.484441236651113
31,Hotel Arena - Restaurant,International,"Hotel Arena is an exciting mix of hotel, restaurant, bar and club. All this under the one roof of a monumental building dating from 1890- the former Saint Elisabeth orphanage. The decor is based on a respect for authentic details. At the heart of the complex is the caf_ that stays open late serving filled rolls, snacks and cocktails. The restaurant offers international cuisine with adventurous taste combinations, and in the popular club various well-known organisations have parties with deejays and acts from home and abroad.",Mo -Su: 17:00 - 22:30 hour.,AMSTERDAM,'s-Gravesandestraat 51,1092 AA,7,27,52.361233,4.916328,4,http://www.hotelarena.nl,https://media.iamsterdam.com/ndtrc/Images/20110201/5643fbd8-be7d-4d83-bd99-5088e687ec42.jpg,24.2738675891264
98,Casa Peru,"","Authentic Peruvian food on an Amsterdam canal? Well, yes ? at Casa Peru on the corner of the Leidsegracht and the Prinsengracht. The restaurant has a huge terrace on the water and serves typical Peruvian dishes such as ceviche de pescado (raw fish), estofado de carne con papas (beef stewed in red wine) and aguadito (filling seafood soup). And to finish with, there are desserts such as warm chocolate pie and Peruvian lemon cake.","",AMSTERDAM,Leidsegracht 68,1016 CP,8,28,52.366437,4.883068,3,http://www.casaperu.nl,https://media.iamsterdam.com/ndtrc/Images/20120521/a0530465-9d30-4f8e-b3ce-83780a86c70f.jpg,0.648783326027291
182,De Liefde,International,"Watch the day go by in Amsterdam?s postage-stamp-sized Bilderdijkpark on a tree-shaded terrace. For something more substantial, order a lamb burger or one of the daily specials. Or, skip to a fudgy brownie and a steamy cup of coffee, and you may never give up your seat.","Mo -Th : 12:00 - 23:00 hour, Fr -Su: 11:00 - 23:00 hour.",AMSTERDAM,Bilderdijkpark 1A,1052 RZ,5,25,52.371427,4.869733,5,http://www.deliefdeamsterdam.nl,https://media.iamsterdam.com/ndtrc/Images/20120910/9e8c6aeb-a1f0-4866-9370-a842a6f48f70.jpg,1.44626456227802
184,De Ponteneur,"","This iconic red brick building, next to the Tropenmuseum, Dappermarkt and Oosterpark, is renowned for its special atmosphere. In the summer months its large terrace is permanently bustling, but the spacious, high-ceilinged interior shouldn?t be underestimated. Combined with a classical-meets-contemporary menu, it?s an ideal location for both solo or larger group visits.","Mo -Th : 09:00 - 01:00 hour, Fr , Sa : 09:00 - 02:00 hour, Su: 10:00 - 01:00 hour.",AMSTERDAM,Eerste van Swindenstraat 581,1093 LC,9,29,52.363409,4.930237,5,http://www.ponteneur.nl/,"",1.1949836348402
235,Restaurant Vermeer,"","Chef Christopher Naylor uses local Dutch ingredients, such as beetroot, Dutch prawns, and white asparagus, liberally on his menu at Michelin-starred Restaurant Vermeer. His passion for seasonal products is especially evident in his seasonal and ?From the Land? menus, where vegetables are his great inspiration.",Mo -Sa : 18:00 - 23:00 hour Su: Open,AMSTERDAM,Prins Hendrikkade 59-72,1012 AD,9,29,52.376375,4.900189,3,"http://www.restaurantvermeer.nl/,http://www.couverts.nl/reserveren/?tt=18978_12_225204_&r=http%3A%2F%2Fen.couverts.nl%2Frestaurant%2Famsterdam%2Frestaurant-vermeer",https://media.iamsterdam.com/ndtrc/Images/20130808/a7152fce-a6fd-4bd4-b6ac-15a9e97f5f85.jpg,0.750629928053487
171,Yamazato,Japanese,"Yamazato, in the Amsterdam?s Okura Hotel, is arguably one of the best Japanese restaurants in Europe. This traditional restaurant earned a Michelin star for its sublime Japanese dishes and serene Zen Bhuddhist interior. Pristine sushi is melt-on-the-tongue fresh, but it?s the kaseiki menu that really shows off the chefs? skills.",Mo -Su: 12:00 - 14:00 and 18:00 - 21:30 hour.,AMSTERDAM,Ferdinand Bolstraat 333,1072 LH,8,28,52.34881,4.893638,5,http://www.yamazato.nl/,https://media.iamsterdam.com/ndtrc/Images/7b/7b31fdf0-72cf-4999-8952-2c25b69ee3b3/232fa1c4-5ddf-4dda-a687-634a5c19de18.jpg,7.3531072239084
251,Greenwoods,American,"Greenwoods has a very respectable lunch menu with salads and sandwiches, plus homemade cakes, but in its essence it?s all about the breakfast and the cream tea here. The breakfast includes all the British and some of the American standards. In general, it?s more Laura Ashley than builder?s breakfast, and the two branches? pretty canal-side locations and terraces fit the mood perfectly. ","",AMSTERDAM,Singel 103,1012 VG,6,26,52.375889,4.891246,5,https://www.facebook.com/GreenwoodsSingel,https://media.iamsterdam.com/ndtrc/Images/20140923/584074a1-fdf9-4ec4-bf85-fb8ff398b22b.jpg,3.58886296361405
276,63graden Foodbar,Italian,"Indulge in 63graden Foodbar?s delicious drinks and Italian food. While the menu changes weekly, Foodbar?s popular antipasti platter of new Italian delicacies is always available.","",AMSTERDAM,Woestduinstraat 63,1058 TB,9,29,52.352762,4.847989,5,http://www.63graden.nl,https://media.iamsterdam.com/ndtrc/Images/8a/8a2eb51f-23b2-40d6-86bb-a0b1b82f67a5/bbcd9dad-06c1-4946-888a-0593a8d4e65d.jpg,1.2344075226377
416,Dulac,French,"They welcome you with open arms at Dulac in the Haarlemmerstraat. Nothing is too much for the staff and the clientele of students, couples and tourists enjoy every moment of it. The caf_ is vast, theatrical and fairy-tale like with plenty of little alcoves, walls painted with trumpets, saxophones, hanging antlers and French posters from 1900 and, standing centrally, a large pool table. What is more, you can eat splendidly here and in the summer dine in the garden. ","",AMSTERDAM,Haarlemmerstraat 118,1013 EX,7,27,52.38095,4.890465,5,"",https://media.iamsterdam.com/ndtrc/Images/db/dbd77313-f9fe-4436-bcc0-85caf4297108/1293b5bd-5165-4201-b9a4-b439d1d4ba55.jpg,3.18979551406053
417,Langendijk,Cafe,"On the Zeeburgerstraat, with a view of a windmill, is the caf_ Langendijk. A popular terrace in the summer around cocktail hour, you can eat delicious tapas, as well as salads and somewhat more serious dishes like leg of lamb or sea bass. On Friday evenings there is a DJ who plays soul, funk and disco, every Sunday afternoon there is live music and they regularly organise barbeques.","",AMSTERDAM,Zeeburgerstraat 1,1018 AG,8,28,52.366849,4.925626,3,http://www.langendijkeetcafe.nl/,"",1.21781668184038
418,Fidelio,Cafe,"At a busy crossroads in Amsterdam-Zuid (South) is caf_-restaurant Fidelio. Inside is very old-fashioned and the menu is simple, but nevertheless every evening the place is full. The place draws in the old locals, students and everything in between. Its popularity is partly because Fidelio is the only caf_ in the area, but also due to the warm hospitality. The large corner terrace is the ideal spot for checking out the chic passersby on the Beethovenstraat.",Mo -Su: 10:00 - 22:30 hour.,AMSTERDAM,Stadionweg 100,1077 SR,5,25,52.346983,4.877022,5,http://www.caferestaurantfidelio.nl/,"",1.65200856399478
335,Mchi Mood Food & Drinks,Chinese,"Mchi Mood Food Drinks is an Asian fusion restaurant, located in IJburg, a neighbourhood of East Amsterdam. Inspiration for the menu comes from Japanese, Thai, Indonesian, Korean and Chinese cuisine and is even accented by some Italian cuisine.","",AMSTERDAM,IJburglaan 1295,1087 JJ,8,28,52.353917,4.998326,4,http://www.mchi.nl/,"",0.598310227985804
400,Midtown grill,International,"At Amsterdam Marriott Hotel's Midtown Grill, the emphasis is on pureness, simplicity, fresh ingredients and quality. The restaurant's menu fuses locally sourced food with international classics.","",AMSTERDAM,Stadhouderskade 12,1054 ES,5,25,52.362245,4.880569,5,http://www.midtowngrill.nl,https://media.iamsterdam.com/ndtrc/Images/bf/bf91601b-de59-45df-ab43-2784977a5d5b/0a0a9c41-08fb-4d6e-a2ca-1e12ceb1699a.jpg,0.73075682357694
322,Eastside Amsterdam,"","It?s not hard to guess in which neighbourhood this restaurant is located, but for further clarification, it is good to know that the owners were also inspired by the lower eastside in New York City. ",We -Su: 10:00 - 16:00 and 17:00 - 22:00 hour.,AMSTERDAM,Sumatrastraat 47,1094 LN,9,29,52.363241,4.935905,4,http://www.eastside.amsterdam/,https://media.iamsterdam.com/ndtrc/Images/69/698bab15-5528-4cdf-87e4-4f2793e35cbc/dc122e6b-7628-47d0-ba5d-f9d255856aea.jpg,1.46424728455055
451,Two for Joy,Cafe,"Excellent coffee made from their own freshly-ground beans and extra-thick sourdough sandwiches: both can be found at Amsterdam cafe Two for Joy. Pull up a chair at a long table or sit back in one of the comfy chairs and enjoy all the goodies on offer. Fan of the coffee? Good news, you can buy all the blends to take home. ","",AMSTERDAM,Haarlemmerdijk 182HS,1013 JK,7,27,52.384074,4.884796,5,http://www.twoforjoy.nl,https://media.iamsterdam.com/ndtrc/Images/20150326/4efa7b97-2c32-4bfa-be8e-3a10ab8c01d0.jpg,17.6726485568837
333,De Japanner,Japanese,"Restaurant De Japanner is located on the Albert Cuyp market in De Pijp neighbourhood of Amsterdam, which is where they source the majority of the ingredients for their menu. Here you can order an assortment of Japanese beer, cocktails and sake all of which are wonderfully paired with Japanese finger food, served until late in the evening. ","",AMSTERDAM,Albert Cuypstraat 228,1073 BN,9,29,52.356399,4.897002,3,http://www.dejapanner.com/,https://media.iamsterdam.com/ndtrc/Images/93/93102794-73dc-4ed6-adec-1f4f6eff9766/3aa482b5-e0c0-4946-8380-a931dd42873c.jpg,1.77828908973726
363,Restaurant & Brasserie Luden,Brasserie,"At Luden in the Spuistraat one can choose: eat quickly but well in the informal atmosphere of the caf_ or take a seat at the set tables in the restaurant for a more official dinner. In the caf_ one can enjoy tasty steaks, pasta, carpaccio and salads: the restaurant serves dishes such as cappuccino of shrimp soup, smoked game ham and halibut from the oven.","",AMSTERDAM,Spuistraat 304-306,1012 VX,7,27,52.369346,4.888655,3,"http://www.luden.nl,http://www.facebook.com/ludenamsterdam/",https://media.iamsterdam.com/ndtrc/Images/20110126/b03329a0-a6dc-4cef-8030-a7e0a705abc3.jpg,2.32447727106364
326,Mozo,"","While you may never discover the secret blend of ras el hanout spices that forms the basis of many of the traditional tajines at this Moroccan restaurant in Amsterdam's De Pijp neighbourhood, all the fun is in the guessing. ","Tu -Th : 17:00 - 22:00 hour, Fr , Sa : 17:00 - 23:00 hour, Su: 17:00 - 22:00 hour.",AMSTERDAM,Van Woustraat 89,1074 AE,5,25,52.354566,4.901736,3,http://www.restaurantmozo.nl/,https://media.iamsterdam.com/ndtrc/Images/3f/3ff86f1a-82d0-4694-81f1-70850de8a67e/7a456f00-b091-44e4-981b-64acbd08ae45.jpg,8.98663453224675
154,Stanislavski,French," Although brasserie/caf_ Stanislavski is based inside the Stadsschouwburg (City Theatre) you don't have to go to the theatre to enjoy the food. The nineteenth century interior has quite a few additional modernisations and it attracts all ages, who come for lunch, dinner or just a cocktail. As well as filled rolls and salads, there are also French brasserie dishes such as oysters, lobster, charcuterie, steak tartare, crpes and crme br_l_e.   ","Mo -Fr : 10:00 - 01:00 hour, Sa , Su: 10:00 - 03:00 hour.",AMSTERDAM,Leidseplein 26,1017 PT,5,25,52.363866,4.88242,3,http://www.stanislavski.nl/,https://media.iamsterdam.com/ndtrc/Images/20120523/38b2335d-1a9d-4347-a02e-55fa4af6431d.jpg,2.11953278981136
358,Burgermeester,French,"This culinary burger spot has several venues around town, with burger options ranging from organic Blonde d'Aquitaine beef to wild salmon. Vegetarians are also catered for with two different types of veggie burgers. If you just can?t choose, order a selection of mini burgers. You won?t find French fries here, but they do offer baked potatoes and corn on the cob.","",AMSTERDAM,Albert Cuypstraat 48,1072 CV,5,25,52.354955,4.890213,4,http://www.burgermeester.eu/,https://media.iamsterdam.com/ndtrc/Images/fd/fd5ff8d4-29f7-4f7e-b4fc-343ef318f461/a8bb50d5-692e-4399-b030-4f99cb5f2dfc.jpg,1.82776949703696
395,Salmuera,Argentinian,"Cure your cravings for authentic Argentinian delicacies on Amsterdam?s Rozengracht. Order a cocktail from the expert mixologists, but don?t leave without trying the spicy, flavoursome South American fare.",Mo -Su: 17:00 - 01:00 hour.,AMSTERDAM,Rozengracht 106-H,1016 NH,7,27,52.373438,4.87931,4,http://sal-amsterdam.nl/,https://media.iamsterdam.com/ndtrc/Images/8d/8daeb26e-cb65-4211-8478-b142a8822218/29a49b4d-c25e-41d7-bd57-ca02bf3b97bf.jpg,0.881465612826644
373,Rancho Argentinian Grill,Argentinian,"As the name suggests, Rancho restaurants are steeped in rich  Argentine culture, taking inspiration from the South American cowboy lifestyle. These cosy restaurants mix up old-fashioned service with modern dishes. Unsurprisingly, the steaks are the lead dish, always using the best quality of beef.","",AMSTERDAM,Gyroscoopweg 132,1042 AZ,6,26,52.401268,4.843843,3,"http://www.rancho.nl,http://www.facebook.com/RanchoSpui/,http://www.facebook.com/RanchoLeidseplein,http://www.facebook.com/RanchoRembrandtplein/",https://media.iamsterdam.com/ndtrc/Images/20120416/7c665e50-5262-43af-a07d-9664e10e4396.jpg,2.20832132858043
413,Caffe Milo,Italian,"Near the Hotel Arena and the Oosterpark (East Park) is bar/restaurant Caffe Milo. The retro-interior of this delightful corner building is in many shades of brown with 60s lamps and curved forms. In front, there is a terrace with white Italian design furniture. The small (and affordable) menu is also Italian with classics such as insalata caprese, tuna carpaccio and pollo al vino. After dining, there is the pleasure of professionally- shaken cocktails and mingling with the incrowd of East Amsterdam.","",AMSTERDAM,Linnaeusstraat 71H,1093 EJ,9,29,52.36011,4.925397,5,http://www.caffemilo.nl,https://media.iamsterdam.com/ndtrc/Images/20120521/81c47539-69da-4e96-9ad3-45c9d2860cff.jpg,1.13470307917234
11,De Bijenkorf Kitchen,International,"De Bijenkorf Amsterdam is an inspiring, trend-setting and dynamic department store. What sets de Bijenkorf Amsterdam apart is its wide range of collections, original themes, events and international brands and private labels in fashion, cosmetics, accessories, homewares, media and travel.   The 'Meester Banket Bakker', is famous for old-fashioned pastries and chocolates. The caf_s and de Bijenkorf Kitchen restaurant are true de Bijenkorf crowd-pleasers.","Mo : 11:00 - 20:00 hour Tu , We : 10:00 - 20:00 hour Th , Fr : 10:00 - 21:00 hour Sa : 09:30 - 20:00 hour Su: 11:00 - 20:00 hour",AMSTERDAM,Dam 1,1012 JS,9,29,52.373248,4.893865,4,http://www.deBijenkorf.nl,https://media.iamsterdam.com/ndtrc/Images/20110125/c19fe1ad-9321-438e-b501-671be4479ab7.jpg,0.976962425995654
85,Bicken,"","'Bicken food and drink' is a team of young but experienced catering guys. In this charming restaurant with its purple touches of colour, one is served perfectly balanced dishes. The range includes soft-shell crab with teriyaki to steak tartar with caper cream and red mullet with roasted sweet pepper sauce. The seating is intimately close so be prepared to make friends with fellow diners.","",AMSTERDAM,Overtoom 28-30,1054 HJ,8,28,52.363816,4.878564,4,http://www.bicken.nl,https://media.iamsterdam.com/ndtrc/Images/20120521/3b24bb08-49d4-461f-906b-b1f14cb8b16a.jpg,2.66038654221953
86,Bickers a/d Werf,"","In a little glass building on the picturesque Bickerseiland is caf_-restaurant Bickers a/d Werf. Drink coffee or enjoy a good glass of wine at the waterside. Dine on original dishes of mustard soup, oysters and fried duck?s liver, oriental chicken sat_ and marinaded tuna.","",AMSTERDAM,Bickerswerf 2,1013 KX,6,26,52.385743,4.890054,3,http://www.bickersaandewerf.nl,https://media.iamsterdam.com/ndtrc/Images/20120521/319574ff-d75a-4f1a-ab48-573a7cb24e69.jpg,0.68305061728935
121,Kantjil en de tijger,Indonesian,"Nasi poetih, sate ajam, rendang, gado gado, sajoer lodegh? these are all small dishes that make up the Indonesian Rice Table. Restaurant Kantjil en de Tijger in the Spuistraat serves authentic ?rijsttafels? or _ la carte dishes in an atmospheric interior. For a quick pot noodle or other Asian snacks one can pop into Kantjil To Go next door.","",AMSTERDAM,Spuistraat 291-293,1012 VS,9,29,52.369325,4.888801,4,http://www.kantjil.nl,https://media.iamsterdam.com/ndtrc/Images/20120522/5affc6df-2e8d-4f7a-8196-1ed7d5fd14b7.jpg,14.9559421729103
205,Aan de Poel,French,"Nearby Amstelveen is worth a trip out of Amsterdam?s city centre, especially if it?s a trip to Michelin-rated Aan de Poel. Chef Stefan van Sprang creates an ever-changing menu steeped in French technique with a judicious sprinkling of far-off flavours. The view from the terrace is so lovely it borders on unreal.",Mo : Closed Tu -Fr : 12:00 - 14:30 and 18:00 - 22:00 hour Sa : 18:00 - 22:00 hour Su: Closed,AMSTELVEEN,Handweg 1,1185 TS,7,27,52.295838,4.844655,5,http://www.restaurantaandepoel.nl/,https://media.iamsterdam.com/ndtrc/Images/20120913/ee96f608-4ebb-4a7b-8830-ba9c3ef7d01e.jpg,0.608492300760824
93,Grand-Caf_ - Brasserie Maximiliaan,Brasserie,"Grand Cafe Brasserie Maximiliaan promises an informal atmosphere in a setting of warm hospitality. Opened in March 2015, guests can enjoy classic brasserie dishes with a modern twist, the renowned High Tea, a glass of wine, or keep it simple with an excellent coffee and delicious selection of pastries. With that in mind, Maximiliaan is a place to see and be seen in the heart of Amsterdam.","",AMSTERDAM,Nieuwezijds Voorburgwal 176-180,1012 SJ,5,25,52.373647,4.890439,4,http://www.dieportvancleve.com,https://media.iamsterdam.com/ndtrc/Images/ef/efa03cae-b515-448d-8dc9-757d9f5104a7/2faf5c83-4936-466a-96b3-314dffdb31ba.jpg,0.940139273543871
219,Restaurant Bloemers,Dutch,This traditional Dutch ?brown caf_? style restaurant in the Pijp neighbourhood is a cosy home away from home. The kitsch chandeliers and a comfortable couch with large cushions make everyone feel instantly at home. Bloemers has a varied menu with alternating daily specials.,"",AMSTERDAM,Hemonystraat 70,1074 BT,9,29,52.355598,4.903461,5,"",https://media.iamsterdam.com/ndtrc/Images/20121116/31c8207a-6dab-4c92-97e5-9ea42537dcb0.jpg,15.3442214975128
1,Smits Noord-Zuid Hollandsch Koffiehuis,Cafe,"The Smits Koffiehuis dates back to 1919. This charming building served as the departure and arrival point for a steam tram that once connected Amsterdam to the northern parts of the Noord Holland province. In addition to the restaurant and caf_, this beautiful landmark in front of Central Station also houses the Tourist Information Office and a GVB (public transport) office. ","",AMSTERDAM,Stationsplein 10,1012 AB,6,26,52.377544,4.900323,4,http://www.smitskoffiehuis.nl,https://media.iamsterdam.com/ndtrc/Images/20101122/ec8faec5-5cd5-43d6-b0fa-eb0dab65e278.jpg,0.520853652124428
