id,title,type,short_description,opening_hours,city,address,zip_code,min_price,max_price,latitude,longitude,rating,url,imgurl,distance_ray
432,Pannenkoekenboot,Pancakes,"Hop on board the Pancake Boat for a cruise around Amsterdam and all-you-can-eat-pancakes. A cosy boat, unlimited pancakes and a view of Amsterdam?s skyline make it a great activity for all ages. ","",AMSTERDAM,ms. van Riemsdijkweg t/o 38,1033 RC,6,26,52.401599,4.892763,5,http://www.pannenkoekenboot.nl/amsterdam,https://media.iamsterdam.com/ndtrc/Images/20110316/c9e55d93-d54d-41d9-9cf1-7b7a2fe985d1.jpg,0.977771744171649
436,Mook Pancakes,Pancakes,"Amsterdam West continues to hold its ground as a food lover's destination with this eatery, which gives a new twist to a much-loved Dutch staple. ",Mo -Su: 09:00 - 21:00 hour.,AMSTERDAM,De Clercqstraat 34,1052 NG,5,25,52.371219,4.871277,5,http://www.facebook.com/mookpancakes/,https://media.iamsterdam.com/ndtrc/Images/cc/cc30f675-1d9d-4cc5-b3a6-3b966fe45bdc/29ea3e7a-6555-4856-be76-05aa75d1190d.jpg,0.532192147609101
193,Bridges,"","Located in Sofitel Legend The Grand Amsterdam, Restaurant Bridges was awarded a Michelin star late in 2013.  ","",AMSTERDAM,Oudezijds Voorburgwal 197,1012 EX,6,26,52.371164,4.895458,5,"",https://media.iamsterdam.com/ndtrc/Images/2f/2f4dd3eb-9430-4b0d-9400-1574375f245d/77cdbf27-bb8c-4ae0-aa6a-55876105856b.jpg,2.10664873919937
185,Senses,International,"Senses restaurant is a specialist in creative and unconventional food art that's carefully designed to tantalise all of your senses. You can choose from a selection of innovative dishes from the menu, or opt for the daily-changing surprise menu, which takes inspiration five senses while showcasing the very best seasonal products.",Mo -Su: 12:00 - 15:00 and 18:00 - 22:30 hour.,AMSTERDAM,Vijzelstraat 45,1017 HE,8,28,52.366009,4.893214,4,http://www.sensesrestaurant.nl,https://media.iamsterdam.com/ndtrc/Images/20120910/c7d5b547-9cd6-4a0c-bdfe-fdbd585c5ef2.jpg,1.16569283790213
186,The ART Brasserie,Brasserie,"You?ll find The ART Brasserie inside Amsterdam?s WestCord Art Hotel. The restaurant is the ideal spot to enjoy a generous breakfast, grab a coffee to go, or have a delicious lunch or dinner. ","",AMSTERDAM,Spaarndammerdijk 302,1013 ZX,7,27,52.392761,4.870686,5,"",https://media.iamsterdam.com/ndtrc/Images/20120910/902cea47-8cd8-4d2a-baf7-3abad5153a9b.jpg,0.832464237386152
351,Carter Bar & Kitchen,French,"Enjoy modern french bistro fare in classy, atmospheric surroundings in Amsterdam's well-heeled Oud-Zuid neighbourhood. Head there for delicious cocktails and a sunny terrace.","Mo -Th : 16:00 - 01:00 hour, Fr : 16:00 - 03:00 hour, Sa : 11:00 - 03:00 hour, Su: 11:00 - 01:00 hour.",AMSTERDAM,Valeriusstraat 85 huis,1071 MG,8,28,52.370215,4.895167,3,http://barcarter.nl,"",1.48553188147658
12,De Kroonprins,Dutch,The Kroonprins is a traditional Dutch restaurant located across the Amsterdam Central Station.,Always open,AMSTERDAM,Prins Hendrikkade 52-57,1012 AC,7,27,52.376552,4.899556,5,http://www.hotel-prinshendrik.nl,https://media.iamsterdam.com/ndtrc/Images/20110125/24cf5ad2-b9fc-4da9-89ed-1f70ed510d38.jpg,0.779777388949112
394,Huis van Lopez,American,Huis van Lopez is a Latin-American restaurant based in the up-and-coming area of De Clercqstraat in Amsterdam West. They serve all the staples of Latin-American food and drink.,"",AMSTERDAM,De Clercqstraat 56,1052 NH,6,26,52.370993,4.869612,4,http://www.facebook.com/huislopez,https://media.iamsterdam.com/ndtrc/Images/44/4462d32d-0a85-46d7-b6da-a57bdf6ee6b9/6bba1c7b-cb56-4136-8b28-852b6ce4f0ab.jpg,0.397288472844027
349,Brasserie Nobel,Brasserie,"Noble, honest and good. Grand Caf_ Nobel, situated in the historic building De Korenbeurs by the river Spaarne in Haarlem, is all about quality and hospitability. In the summer, chill out on the terrace by the water. Grand Caf_ Nobel is open 7 days a week for a nice cup of coffee, lunch (including the Caf_?s very popular bread rolls) , high tea, a lovely glass of wine or dinner.","",HAARLEM,Spaarne 36,2011 CJ,9,29,52.379972,4.639093,5,http://www.brasserienobel.nl,https://media.iamsterdam.com/ndtrc/Images/11/119e5539-164e-48f8-bc77-c213022528c0/e351cd86-1d6f-479f-9c69-02f24c73aa16.jpg,1.10895905448611
104,Campisi's Egyptian Restaurant,Italian,Typical italian restaurant with homemade product.,"",AMSTERDAM,Prins Bernhardplein 175,1097 BL,8,28,52.348447,4.917197,3,http://www.caferestaurantdauphine.nl,https://media.iamsterdam.com/ndtrc/Images/20120521/3b8f0327-63e0-4bd6-8f8e-4cf34ad8d2ff.jpg,1.13835501268985
255,De Vier Seizoenen,French,"As the restaurant?s name (The Four Seasons) suggests, it?s all about seasonal produce at Ton & Ellin Frerik?s place in Lisse. The menu (and wine list) changes four times a year and features French dishes with Oriental influences, alongside more traditional Dutch fare. And if that wasn?t enough, there?s also a special monthly menu and the Chef?s Menu, which changes on a daily basis. ","",LISSE,Heereweg 224,2161 BR,5,25,52.259241,4.553542,5,"",https://media.iamsterdam.com/ndtrc/Images/20141122/6f88e2f0-55b9-4c09-9d0a-e56f0a77120f.jpg,1.81754717953962
264,Brasserie Nacional,French,"Aiming to channel the spirit of French bistros from the early 20th century, Amsterdam?s Brasserie Nacional puts on the classics: think steak tartare, duck confit and madeleines.  ","",AMSTERDAM,Kleine-Gartmanplantsoen 11,1017 RP,8,28,52.362811,4.883481,3,http://www.nacional.nl,https://media.iamsterdam.com/ndtrc/Images/20150218/b8c01f5c-5dd3-4220-8484-8bfafba00e55.jpg,2.49203388054001
131,Defonte's,Italian,Typical italian restaurant with homemade product.,"",AMSTERDAM,Quellijnstraat 104,1072 XZ,7,27,52.356654,4.89205,5,http://www.restaurantmamouche.nl/,https://media.iamsterdam.com/ndtrc/Images/87/87c49703-ee56-494b-9b1c-e91965f214bf/ee446dbd-dfa8-4348-afec-0d5d9939d187.jpg,1.81935611711352
3,Akbar Indian Restaurant,Indian,"A chic restaurant, decorated in Moghul style, which gives guests the impression of having a meal in India. The kitchen serves dishes originating from the North of India/Punjabi style. ",ma-zo: 16:30 - 00:30 uur,AMSTERDAM,Korte Leidsedwarsstraat 15,1017 PV,9,29,52.365289,4.881914,5,http://www.akbar.nl,"",5.86233454259644
14,Sushiko,Japanese,Tasty sushi restaurant based on japanese traditions.,Mo -Su: 07:00 - 22:00 hour,ZAANDIJK,Lagedijk 32-34,1544 BG,5,25,52.471877,4.811849,5,http://www.devijfbroers.nl,https://media.iamsterdam.com/ndtrc/Images/20110127/3f14dad7-de7e-4cd0-8242-ecf012d47f3b.jpg,0.479329511236621
313,Kaagman & Kortekaas,"","Kaagman & Kortekaas is inspired by the contemporary Parisian bistro, but is nestled in the heart of old Amsterdam within walking distance from Dam square and Central Station. The small menu changes on a weekly basis, and is highly dependent upon seasonal, fresh ingredients.  ","",AMSTERDAM,Sint Nicolaasstraat,1012 NJ,9,29,52.375342,4.893535,4,http://kaagmanenkortekaas.nl/,https://media.iamsterdam.com/ndtrc/Images/fd/fde04321-e20b-490a-9d72-b1989ade0116/0048f07f-0050-428b-926d-c839db5bcd8f.jpg,0.455887696840565
390,Oriental City,Chinese,Oriental City is a multi-floor restaurant that serves traditional and innovative Chinese food. It is located in the centre of Amsterdam.,"",AMSTERDAM,Oudezijds Voorburgwal 177-179,1012 EV,8,28,52.371865,4.896288,5,http://www.oriental-city.com/,https://media.iamsterdam.com/ndtrc/Images/e3/e33be20d-2f18-42d9-8fdc-699d0b4dff8c/ce111c1c-217c-4971-b79e-b08fc4ee1735.jpg,2.85444060256497
149,Frankie & Benny's,Italian,Typical italian restaurant with homemade product.,"Mo -We : 18:00 - 23:00 hour, Th -Sa : 18:00 - 00:00 hour, Su: 17:00 - 23:00 hour.",AMSTERDAM,Keizersgracht 594,1017 EN,9,29,52.36407,4.889166,3,"",https://media.iamsterdam.com/ndtrc/Images/20120523/fa1ff9ab-8b94-42a6-a253-b8b8453b04ef.jpg,0.470851872620424
42,Il Bombolino d'Agosto,Italian,Italian restaurant with long background,"",VELSEN-ZUID,Oostbroekerweg 17,1981 LR,6,26,52.444983,4.669006,3,http://www.spaarnwouderesort.com,https://media.iamsterdam.com/ndtrc/Images/20110217/594b2303-4d49-421c-89ab-85992115d5c1.jpg,15.1893600441573
34,Lo Voglio,Italian,"Italian restaurant with main dishes, pizzas and meats",Mo -Su: 17:00 - 23:00 hour,AMSTERDAM,Westermarkt 29HS,1016 DJ,6,26,52.373915,4.883652,5,"",https://media.iamsterdam.com/ndtrc/Images/20110203/063b07f6-4d8c-4407-a0b9-b5ee14fb4585.jpg,42.2772945269182
332,ICHI-E,Japanese,"Some of Amsterdam?s best sushi ? and other Japanese specialities ? can be found at Ichi-E, conveniently located for pre-gig, film or game food.",Mo -Su: 11:30 - 22:00 hour.,AMSTERDAM,Arena boulevard 175,1101 EJ,8,28,52.313107,4.945243,4,http://ichi-e.nl,https://media.iamsterdam.com/ndtrc/Images/8a/8a4d94c9-9db3-4667-bb46-da9f4921ef3a/dbdfbbf2-9884-491e-875f-deff38440307.jpg,0.858782677249528
155,Take Thai,"","Take Thai in the Utrechtsestraat definately differs from the usual Thai restaurant. There are no bamboo or Buddha statues to be seen: instead just a simple white decor. The dishes, too, often have a luxurious modern twist and the food on the plates is thoughtfully composed. Consider salmon with ginger and plums or veal in Massaman curry","",AMSTERDAM,Utrechtsestraat 87,1017 VK,5,25,52.363091,4.898681,4,http://www.takethai.com/,"",1.68495364250833
330,Breda,International,"Diners at Breda on Amsterdam's Singel canal have to be in an adventurous mood: their Burgundian cuisine with international polish is served as a surprise menu, where the only thing visitors have a say in is the size of their plate.",Mo -Su: 12:00 - 13:00 and 18:00 - 22:00 hour.,AMSTERDAM,Singel 210,1016 AB,7,27,52.373828,4.888615,4,http://www.breda-amsterdam.com/,https://media.iamsterdam.com/ndtrc/Images/29/2905bec2-2ada-432a-bdc7-01195a26f6b3/c31b9ffe-eb13-416f-8d66-a22b5e7baaae.jpg,0.668796741781462
403,Restaurant Classico,Italian,"Restaurant Classico is nestled between the narrow, little streets of South Amsterdam, boasting authentic Italian cuisine, fine wines and a romantic atmosphere.",Explanation: Daily: Lunch 12.30 - 15.30 hour: reservation required Diner 17.30 - 22.30 hour.,AMSTERDAM,Willemsparkweg 87,1071 GT,8,28,52.356846,4.874336,3,http://www.classicoamsterdam.nl/,https://media.iamsterdam.com/ndtrc/Images/1b/1b0220e6-c1d2-4bc3-8082-35d17f39e4fa/b1e58540-e771-4ac1-b46f-c60cfe0f114a.jpg,21.0945400907561
224,Brasserie Caf_ Oevers,Brasserie,"Located on the picturesque banks of the Westeinderplassen in Kudelstaart, this charming restaurant offers fantastic views of the lake. Brasserie Oevers is the perfect place for a business lunch, romantic dinner or a lively evening out and with more than 80 seats, the expansive terrace is a popular spot when the sun shines.","",KUDELSTAART,Kudelstaartseweg 228,1433 GR,8,28,52.236622,4.74888,3,http://www.brasserieoevers.nl,https://media.iamsterdam.com/ndtrc/Images/20130305/2c319f50-fc1f-4ea6-bb10-f605c9849f51.jpg,1.67911591451582
190,East57,"","The restaurant of Hotel Casa 400, named East57, is a vibrant space that combines a coffee corner, delicatessen, restaurant and wine bar. The restaurant specialises in local delicacies, providing inspiration for salads, sandwiches and meat/cheese platters. The wine bar serves more than 100 different wines, selected by`Gouden Ton'. If you're not sure where to start, simply ask the on-hand specialist. You can also buy wine to go, as well as meats, coffee and more. ","",AMSTERDAM,Eerste Ringdijkstraat 4,1097 BC,6,26,52.349719,4.919187,3,http://www.hotelcasa400.nl,https://media.iamsterdam.com/ndtrc/Images/20120910/d6f88526-6eba-4132-8012-77465a280e12.jpg,1.61794384248274
4,Alfonso's Mexican Restaurant,Mexican,"Mexican food at its finest. Delicious fajitas, tacos, burritos and tortillas. You won't easily find them more Mexican than Alfonso.",Mo -Su: 17:00 - 23:00 hour,AMSTERDAM,Utrechtsestraat 32,1017 VN,5,25,52.364421,4.897942,3,http://www.alfonsosrestaurant.com,https://media.iamsterdam.com/ndtrc/Images/20110124/e888e5d3-c02b-4966-bf0e-64c1510391b9.jpg,0.369320136297909
334,Janz.,Dutch,"In the Nine Streets within the Pulitzer Hotel is Jansz., a fine-dining restaurant that serves modern classics with a laid-back Dutch flair. On the menu not only will you find typical hotel classics, like the Rueben-sandwich and Nioise salad, but also tasty twists like the lobster ravioli and the Reypenaer cheese burger.  ","Mo -Th : 06:30 - 22:00 hour, Fr , Sa : 06:30 - 23:00 hour, Su: 06:00 - 22:00 hour.",AMSTERDAM,Reestraat 8,1016 DN,6,26,52.372383,4.884277,3,http://www.janszamsterdam.com/,https://media.iamsterdam.com/ndtrc/Images/cd/cdadbad3-1c8a-4d5c-a715-4a12d209a67a/1ad4e57e-7641-4440-8ee6-e67bf06814f5.jpg,1.3937189570001
433,Pancakes! Prins Hendrikkade,Dutch,"Serving up traditional Dutch cuisine in modern Dutch surroundings, this recently opened branch of the popular Amsterdam pancake house is conveniently located on Prins Hendrikkade, just across from Central Station.",Mo -Su: 09:00 - 19:00 hour.,AMSTERDAM,Prins Hendrikkade 48,1012 AC,9,29,52.376618,4.899337,4,http://www.pancakesamsterdam.com/,https://media.iamsterdam.com/ndtrc/Images/35/35bb9309-6d06-48a6-80f5-927f2dca5884/8c0498b7-d68d-4b88-9fa7-0932be02052c.jpg,2.1443487650096
124,Cibo Espresso,Italian,Typical italian restaurant with homemade product.,"",AMSTERDAM,Egelantiersstraat 122-124,1015 PR,9,29,52.376746,4.882308,3,http://www.laoliva.nl/,https://media.iamsterdam.com/ndtrc/Images/20120522/2d4ac8fc-2ce1-4c9a-a3da-a823948c5134.jpg,0.685627832120989
324,Restaurant CHI,Chiniese,"In Mandarin, ?Chi? means ?food? and as a result, is considered the ultimate life energy. Restaurant CHI in Amsterdam Zuid takes this responsibility to heart, and offers a diverse menu that features dishes deriving from both Chinese and Japanese cuisine. Consider sharing sushi, sashimi, dim sum and fried shrimp with your friends over one big table.    ",Tu -Su: 17:00 - 23:00 hour.,AMSTERDAM,Amstelveenseweg 128,1075 XL,8,28,52.354568,4.855456,4,http://www.restaurantchi.nl/,https://media.iamsterdam.com/ndtrc/Images/e6/e69814c8-4c78-46f1-ae05-a158b9595223/de37e649-7329-4237-9777-b86f46abeca4.jpg,1.34924821659957
2,Afrikaans Restaurant Kilimanjaro,African ,"An African (Senegal, Ghana, South-Africa a.o.) restaurant, across the street from NEMO, close to the Waterlooplein. The menu will suit those who don?t want an everyday meal. A real sensation of taste.",Mo : Closed Tu -Fr : 16:00 - 00:00 hour Sa : Closed Su: 16:00 - 00:00 hour,AMSTERDAM,Rapenburgerplein 6 HS,1011 VB,5,25,52.370324,4.910838,5,"","",1.39975219627329
292,Voldaan,Dutch,"Soup, soup, soup and more soup: Voldaan on Amsterdam's J.P. Heijestraat knows what's good for us, and offers a large variety of it, from Arabic lentil soup with sultanas to traditional, warming Dutch fare. ","",AMSTERDAM,Jan Pieter Heijestraat 121,1054 ME,5,25,52.362304,4.864485,5,http://www.facebook.com/voldaan.amsterdam,https://media.iamsterdam.com/ndtrc/Images/42/423d3758-df83-49ca-b108-626fa9abecdb/1b4e4966-9ad6-4899-844d-c6dbcb68a0e9.jpg,0.839604514728143
452,My Little Patisserie,French,This lovely little Parisian-style bakery is the realisation of French-born Audrey Kriel?s dream of escaping the drudgery of the office to work with her hands. ,"",AMSTERDAM,1e van der Helststraat 63,1073 AD,7,27,52.354776,4.893498,5,http://www.mylittlepatisserie.nl,https://media.iamsterdam.com/ndtrc/Images/d1/d15cc3dc-1f35-478f-bbec-5b89c2dce618/d0032d59-f5d4-40f8-be73-5110c76bbfe3.jpg,22.8550553120821
314,Mossel & Gin,"","This restaurant at Amsterdam?s Westergasfabriek specialises in ? you guessed it ? mussels and G&Ts, plus oysters, lobster and other maritime delicacies. ","Tu -Th : 16:00 - 01:00 hour, Fr : 16:00 - 03:00 hour, Sa : 13:00 - 03:00 hour, Su: 13:00 - 01:00 hour.",AMSTERDAM,Gosschalklaan 12,1014 DC,5,25,52.386448,4.868041,4,http://www.mosselengin.nl/,https://media.iamsterdam.com/ndtrc/Images/b6/b68b7bdc-efab-4b3f-b6ee-42560a6cd475/ebee68f7-0f53-4c34-aa6e-353eab784235.jpg,1.87575808461724
430,Caf_ Fabriek,Cafe,"","Mo : 19:30 - 00:00 hour, Tu -Th : 14:30 - 00:00 hour, Fr : 14:30 - 01:00 hour, Sa : 13:00 - 01:00 hour, Su: 13:00 - 00:00 hour.",ZAANDAM,Jan Sijbrandsteeg 12,1502 BA,7,27,52.440917,4.825532,3,"http://www.cafefabriek.nl/,http://www.facebook.com/Caf_-Fabriek-148620725200003/",https://media.iamsterdam.com/ndtrc/Images/82/8266555c-6984-473b-8f49-d4406ad90e75/3f87d292-b8b8-449f-ba0a-89804742fd58.jpg,2.39802895422267
352,Renato's Osteria,Italian,"The popular Renato?s Pizzeria in De Pijp, Amsterdam, has expanded along the road with the opening of the new Renato?s Osteria, where you can find good wine and simple, homemade pasta served in a homely atmosphere. ",Mo -Su: 17:30 - 23:00 hour.,AMSTERDAM,Van der Helstplein 10,1072 PH,9,29,52.351537,4.894711,4,http://www.renatososteria.nl,https://media.iamsterdam.com/ndtrc/Images/c5/c5a4c267-fbe1-411b-8dd0-d7261b915e2b/449e4a89-4b26-4c3f-b059-1d4a8f9da311.jpg,0.92583317906609
311,Rolling Rock Kitchen,"","Known simply by some as 'The Rock', this hangar-style bar and eaterie in Amsterdam North offers fine food, drink and good times with waterfront views over the IJ. ","",AMSTERDAM,Distelweg 113,1031 HD,6,26,52.39542,4.897983,5,http://rollingrockkitchen.com/,https://media.iamsterdam.com/ndtrc/Images/54/54cb3c84-9715-42c8-ba28-872d1c6bc479/f6a3f457-7938-4efa-9c9b-4403d55b8ed8.jpg,1.11839460525738
331,Supermercado,Spanish,"Dine on some of the most delicious chicken and homemade burgers in all of Amsterdam, followed by some churros and chocolate, coffee or carajillo (Spanish coffee with brandy).","Tu -Fr : 16:00 - 01:00 hour, Sa , Su: 12:00 - 01:00 hour.",AMSTERDAM,Amstelveenseweg 192,1075 XR,8,28,52.352151,4.855952,4,http://restaurantsupermercado.nl,https://media.iamsterdam.com/ndtrc/Images/2a/2a3dee70-056c-4835-bbce-ec15f9347c85/840443f1-db12-4c49-ade9-dbe5bb781682.jpg,1.14977023250971
393,Salsa Shop CS,Mexican,"The fresh flavours of Mexico have arrived at Amsterdam Central Station Satisfy your spice cravings with burritos, tacos and Mexican salads made the way you want them at Salsa Shop's third Amsterdam Location. ","",AMSTERDAM,Amstelstraat 43L,1017 DA,9,29,52.366253,4.899712,5,http://salsashop.com/,https://media.iamsterdam.com/ndtrc/Images/50/50688d56-aafc-4194-b686-844e419aaf5c/5706a637-dff9-4f07-a373-227add587108.jpg,1.71437896208022
365,Restaurant Haesje Claes,Dutch,"Extended over six different interconnecting buildings, all exquisitely decorated, Restaurant Haesje Claes in Amsterdam serves up a delicious lunch or dinner in a traditional Dutch setting.",Mo -Su: 12:00 - 22:00 hour,AMSTERDAM,Spuistraat  275,1012 RV,6,26,52.369849,4.889115,5,"http://www.haesjeclaes.nl,http://www.facebook.com/Haesje.Claes/",https://media.iamsterdam.com/ndtrc/Images/20110127/928244ae-b760-4eef-96d8-b1e4a1a2770c.jpg,1.06966669387529
7,De Stijl,"","In Design Hotel Artemis, caf_-restaurant ?De Stijl? has a great terrace overlooking the pond. Inspiration for this location was the homonymous artist movement De Stijl (Piet Mondriaan).","Mo -Th : 07:00 - 00:00 hour Fr : 07:00 - 23:00 hour Sa , Su: 08:00 - 23:00 hour",AMSTERDAM,John M. Keynesplein 2,1066 EP,6,26,52.341733,4.825104,4,http://www.artemisamsterdam.com,https://media.iamsterdam.com/ndtrc/Images/20110125/4a6b5681-afa0-49e4-a16b-6f9db9d19522.jpg,0.609355784124364
323,Ibis,African,"Fans of Ethiopian cuisine?s sour, spongy injera pancakes, chilli-spiked stews and mushy legume-based salads should head to Amsterdam East, to what some consider the city?s best East African eetcaf_.  ",Tu -Su: 17:00 - 01:00 hour.,AMSTERDAM,Weesperzijde 43,1091 EE,9,29,52.355784,4.907324,4,"",https://media.iamsterdam.com/ndtrc/Images/b0/b0ac10e0-5d41-40a8-b38d-7c406010a2a0/1ce7891f-a5c0-48ee-bcf5-646a2d99f8c8.jpg,0.693170897561953
341,The Seafood Market,French,"The Seafood Bar was founded to satisfy one man?s passion for the Burgundian lifestyle, one that is based upon fresh seafood and a good glass of wine after a hard day?s work. Classic French craftsmanship and authenticity is maintained, and the communal concept of the evening meal is preserved, albeit, thanks to an extensive stretch of bar space. A selection of seasonal fruits de mer are brought in fresh daily, and are prepared according to a variety of international recipes such as Spanish ceviche, Japanese tempura prawns, and English fish & chips. ",Mo -Su: 11:00 - 22:00 hour.,AMSTERDAM,Ferdinand Bolstraat 32,1072 LK,5,25,52.356461,4.890581,3,http://www.theseafoodbar.nl/,https://media.iamsterdam.com/ndtrc/Images/93/93e1d2bf-433e-4e82-9787-d506249986bf/7ee484a5-a592-42b0-854c-2a9eb706694d.jpg,0.50552401707784
84,Beulings,French,"Restaurant Beulings is tucked away in a lovely spot in a small side street off the Herengracht. The food is pure: an Italian/French no-nonsense kitchen, as the owners call it. Nearly everything is homemade: from sausages with fennel seed to ravioli with lobster meat. Every day there is a different menu with three to five courses. The decor is modern, classic and unfussy.","",AMSTERDAM,Beulingstraat 9,1017 BA,8,28,52.36802,4.887692,5,http://www.beulings.nl,https://media.iamsterdam.com/ndtrc/Images/20120521/5238dcb8-3bfe-439e-a974-4cc7ec369a64.jpg,1.17679993168922
88,Blauw aan de Wal,"","Restaurant Blauw aan de Wal is surrounded by a lot of red: it is situated bang in the Red Light District. Walk along the glowing neon lights, through a historic arch and into a charming courtyard where the restaurant is. The food is of a high standard and you can enjoy a series of tastecapades from raw, marinated monkfish with a beurre blanc to tender venison steaks and the best ever chocolate desserts.","",AMSTERDAM,Oudezijds Achterburgwal 99,1012 DD,9,29,52.37242,4.898051,5,"http://www.blauwaandewal.com,http://www.couverts.nl/reserveren/?tt=18978_12_225204_&r=http%3A%2F%2Fen.couverts.nl%2Frestaurant%2Famsterdam%2Fblauw-aan-de-wal","",3.40882971669689
253,Trust,"","This tranquil cafe is the perfect place to relax amidst the frenetic Albert Cuypmarkt. The menu at Trust features a delicious range of dishes, from sandwiches to richly-filled salads and hearty soups (and gorgeous deserts ? don?t miss their sweet banana bread!). ","",AMSTERDAM,Albert Cuypstraat 210,1073 BM,8,28,52.356073,4.896228,5,http://www.trustamsterdam.org,https://media.iamsterdam.com/ndtrc/Images/20141015/681dcd43-f7a3-4a14-b369-0ff798c27d14.jpg,1.42743489792355
379,St. George,Argentinian,St. George Argentinian Grill Restaurant is located in the heart of Amsterdam and serves the best quality beef from Argentina. A great place to enjoy your diner or lunch or some drinks at the terrace.,"Mo -Fr : 10:30 - 01:00 hour, Sa , Su: 10:00 - 01:00 hour.",AMSTERDAM,Nieuwezijds Voorburgwal 93/95,1012 RE,9,29,52.374832,4.892056,4,"http://www.restaurantstgeorge.nl/,http://www.facebook.com/ArgentijnsRestaurantStGeorge/",https://media.iamsterdam.com/ndtrc/Images/20110131/183429ce-4dfb-4069-b968-a5621212cabf.jpg,3.36720221947574
380,Bazar Amsterdam,Pakistanese,Immerse yourself in the wondrous culinary world of Bazar. This Middle Eastern and North African restaurant hides behind the doors of an old church in the heart of the Pijp neighbourhood of Amsterdam. ,Mo -Th : 11:00 - 00:00 hour Fr : 11:00 - 01:00 hour Sa : 09:00 - 01:00 hour Su: 09:00 - 00:00 hour,AMSTERDAM,Albert Cuypstraat 182,1073 BL,7,27,52.355514,4.893203,4,"http://www.bazaramsterdam.nl,http://www.facebook.com/bazar.amsterdam.5",https://media.iamsterdam.com/ndtrc/Images/20110131/75ef8b18-b618-4b3e-881a-8094a1db466d.jpg,0.611504488286511
441,Frozen Yoghurt Company,Dutch,"Stop by the Frozen Yoghurt Company for a mouth-watering scoop of organic Dutch frozen yoghurt. At the toppings bar you can decorate your dessert with a choice of nuts, candy, fruit and more. Besides yoghurt, you can treat yourself to a fresh, hot waffle ? delicious plain, but even better drizzled with chocolate sauce.",Mo -Su: 13:00 - 21:00 hour,AMSTERDAM,Utrechtsestraat 115,1017 VL,9,29,52.362577,4.898861,3,http://www.frozenyoghurtcompany.com,https://media.iamsterdam.com/ndtrc/Images/20130624/8f578138-5577-4221-8f36-b6fe345ca322.jpg,1.89704127069545
288,Instock,"","Tackling the problem of food wastage one meal at a time, InStock turns leftovers into quality dining, creating delicious dishes with locally sourced food that would otherwise be thrown out. ","",AMSTERDAM,Czaar Peterstraat 21,1018 NW,6,26,52.368625,4.926512,4,"",https://media.iamsterdam.com/ndtrc/Images/68/6863752f-5ffb-4f2b-ab6c-c9e9ca4334a8/f0489428-aefc-4564-8dce-ffa8aca7b197.jpg,2.47929452959905
406,Caf_ het Paleis,Cafe,"Caf_-restaurant Paleis, just behind the Paleis (Palace) on the Dam, has been a favourite for years because of its affordable dishes and is also a great spot to drop in for a drink. Many students come to this cosy but modern place after their exams, shoppers come here after a day out and freelancers hold their work meetings here. It has a nice terrace in the summer. Tarts, filled rolls, pasta, salads and soups are on the menu.","Mo : 09:30 - 00:00 hour Tu -Th : 09:30 - 01:00 hour Fr , Sa : 09:30 - 02:00 hour Su: 09:30 - 00:00 hour",AMSTERDAM,Paleisstraat 16,1012 RB,7,27,52.372302,4.889015,3,"",https://media.iamsterdam.com/ndtrc/Images/20110124/7baf3cbe-8c82-43e7-9813-30dd2ef2bcd2.jpg,21.60615203173
411,Caf_ 't Blaauwhooft,Cafe,"Situated on the picturesque Bickerseiland with a big terrace is bar food caf_ 't Blaauwhooft. On the outside it looks pretty new but inside it is full of historic details like stained glass, paintings of sea views and spherical glass lamps. Every evening it?s packed with a happy crowd of drinkers and diners from the neighbourhood. There are typical traditional bar food dishes on the menu such as sat_, mussels and cheese fondue. They organise endless activities: everything from football matches and the Eurovision song contest on a big screen to live music on Saturday evenings.","",AMSTERDAM,Hendrik Jonkerplein 1,1013 KM,8,28,52.383788,4.888886,5,http://www.blaauwhooft.nl,"",0.909053511766553
